id,text,district,year
4363,"Less attractive to live in due to problems with traffic, growth and ineffective long term planning.",3,2017
4364,Less government is better.,5,2017
4365,Please shrink the cost and amount of local government as much as possible.,5,2017
4366,LET THE MARKET WORK WITH REGARD TO PERMITS AND PLANNING.,8,2017
4367,GOVERNMENT WASTES RESOURCES IN FIGHTING OR TRYING TO CHANGE THE MARKET.,8,2017
4368,Let us water our lawn 2 times a week.,6,2017
4369,Let's get tax increases under control.,7,2017
4370,"City is now becoming too expensive to live in, due to taxes.",7,2017
4371,LET'S MAKE THIS CITY SOLAR POWERED AND RECYCLING MANDATORY,3,2017
4372,Lets manage growth and make sure we don't lose sight of what made us who we are.,8,2017
4373,Liberal mindset does not represent everyone,6,2017
4374,LIBRARY-YOU NEED TO PUT FILTERS ON THE INTERNET ACCESS.,6,2017
4375,NO PORN SITES.,6,2017
4376,I UNDERSTAND PROVIDING INTERNET-BUT WE DO NOT NEED TO PROVIDE ACCESS TO PORN.,6,2017
4377,LIGHT RAIL SYSTEM SHOULD GO WHERE PEOPLE NEED IT.,6,2017
4378,limit height of buildings downtown.,1,2017
4379,do something about property tax,1,2017
4380,"Listen to the voters, not your ego.",5,2017
4381,"Help solve the homeless problem here, don't encourage people to be homeless, and don't attempt to punish those who work hard to not be.",5,2017
4382,"LOCAL GOVT SERVES LOCAL NEED, TIME/RESOURCES ARE WASTED DEBATING AND TAKING POSITIONS ON STATE AND FEDERAL ISSUES.",10,2017
4383,FOCUS SOLELY ON  YOU RESPONSIBILITY TO ALL CITIZENS AND THEIR CITY GOVT NEEDS (IT'S ALSO DIVISIVE TO OUR COMMUNITY,10,2017
4384,LOVE AUSTIN AND APPRECIATE THE CITY EFFORTS TO ENGAGE AND INVOLVE RESIDENT'S INPUT.,10,2017
4385,"AS AUSTIN GROWS, TRAFFIC MUST BE DEALT WITH MORE EFFECTIVELY.",10,2017
4386,"LOVE THIS CITY,BUT IT HAS NOT PREPARED FOR THE GROWTH AND IT IS BUCKLING ON THE WEIGHT OF ALL THE PEOPLE AND TRAFFIC.",6,2017
4387,Low rent needed for housing,4,2017
4388,LOWER ELECTRIC AND WATER RATES.,8,2017
4389,LOWER ELECTRIC BILLS,7,2017
4390,Lower electric services,10,2017
4391,Lower my home taxes please,2,2017
4392,LOWER MY PROPERTY TAXES !!!,4,2017
4393,Soon I won't be able to afford to live in Austin anymore.,4,2017
4394,The City doesn't care about people like me who have lived here a long time (31 years).,4,2017
4395,You are catering too much to the Californians and others who are invading and destroying this city.,4,2017
4396,The quality of life has gone downhill so much in the past 5 years that I am considering moving away.,4,2017
4397,I'm tired of seeing my property taxes skyrocket year after year and me getting nothing in return.,4,2017
4398,"You focus too much on feel-good programs like plastic bag bans and bike trails and don't address real problems like traffic, affordability and taxes.",4,2017
4399,"Bikes are fine you're not being realistic about bikes being a legitimate form of transportation in Austin with in 100+ degree heat in the summers and you're also assuming everybody is lean young and fit, which isn't the case!",4,2017
4400,Lower my taxes at any cost!,8,2017
4401,lower our property taxes already!,3,2017
4402,Lower property tax,4,2017
4403,lower property taxes,3,2017
4404,Lower property taxes and improve congestion on major roadways.,6,2017
4405,LOWER PROPERTY TAXES!,7,2017
4406,"LOWER PROPERTY TAXES, DO NOT CONTINUE TO BE A SANCTUARY CITY.",8,2017
4407,Lower property taxes.,8,2016
4408,Lower property taxes.,3,2016
4409,Lower property taxes.,5,2017
4410,Lower property taxes.,3,2017
4411,Look at other avenues for money and not resident property taxes.,3,2017
4412,I am tired of seeing homeless people on our streets.,3,2017
4413,Stop spending a lot of money on the homeless.,3,2017
4414,"They are mobile, allow them to leave.",3,2017
4415,"lower taxes and price of homes,     stop being a sanctuary city",7,2017
4416,LOWER TAXES AND UTILITIES,6,2017
4417,MAINTAIN AFFORDABLE HOUSING FOR HISTORIC BLACK & LATIN COMMUNITIES.,3,2017
4418,"MAINTAIN AUSTIN STREETS/HIGHWAYS, PU TRASH, MOW THE GRASS, MAKE OUR CITY BEAUTIFUL AGAIN",7,2017
4419,"MAINTAIN EXCELLENT LIBRARY SERVICES, THANK YOU FOR INVESTING IN THE LIBRARIES",6,2017
4420,MAINTAIN SOUTH AUSTIN STREETS AND UNDERPASSES.,5,2017
4421,"PEOPLE COMING INTO AUSTIN SEE WEEDS, GRAFFITI AND HOMELESS EVERYWHERE.",5,2017
4422,Maintenance of sidewalks where grass are not trimmed at all.,8,2017
4423,This is very common in a lot of sidewalks.,8,2017
4424,MAKE AUSTIN AFFORDABLE,9,2017
4425,MAKE AUSTIN AFFORDABLE.,1,2017
4426,RENT COST OF LIVING IS TOO HIGH.,1,2017
4427,"Make Austin safe to drive, reduce traffic congestion.",6,2017
4428,make bike commuting safe,8,2017
4429,Make companies pay their fair share.,9,2017
4430,Lower property taxes so I can retire in my home,9,2017
4431,MAKE IT A CRIME FOR PROTESTERS TO WEAR CLOTHING THAT HIDES A PERSONS FACE.,3,2017
4432,MAKE IT ARREST-ABLE FOR ANY PROTESTER WHO INSTIGATES VIOLENCE AGAINST PEOPLE AND PROPERTY.,3,2017
4433,THANK YOU VERY MUCH!,3,2017
4434,"MAKE IT EASIER FOR BIKES/PEDESTRIAN TO MOVE ACROSS MAJOR BARRIERS (LARGE THOROUGHFARES,HIGHWAYS, WATERWAYS)",4,2017
4435,"Make owning a small business in Austin easier by providing tax abatements, higher energy rebates, more promotion.",5,2017
4436,MAKE RECYCLING MANDATORY FOR BUSINESSES/HOMES AND FINE PEOPLE IF THEY DON'T.,3,2017
4437,Make Red River safer!!,1,2017
4438,MAKE RESIDENTIAL HOUSING BUILDING PROCESS EFFICIENT CONTINUE INVESTING IN MASS TRANSPORTATION.,10,2017
4439,Make streets safe for bike,3,2017
4440,MAKE TAXES MORE AFFORDABLE.,10,2017
4441,THEY INCREASE EACH YEAR AND QUITE FRANKLY WHERE I LIVE WE GET LITTLE VALUE FOR HOW MUCH WE PAY.,10,2017
4442,make the  city code comprehensible,4,2017
4443,Manage growth!,6,2017
4444,"Need health for dental, a cap on rent, more fresh foods",4,2017
4445,more efforts to keep it affordable.,9,2017
4446,Better public transportation,9,2017
4447,SAFETY AND EDUCATION,6,2017
4448,MANAGERS AT ALL LEVELS OF CITY OF AUSTIN DO NOT MANAGE AND ALLOW EMPLOYEES TO INTERPRET RULES HOW THEY SEE IT.,9,2017
4449,SO THERE IS NO CONSISTENCY AND MANAGEMENT DOES NOT OVERRULE.,9,2017
4450,EMPLOYEES SEEM TO BE ALWAYS WORRIED IN PROTECTING THEIR OWN TERRITORY INSTEAD OF DOING WHAT THEY ARE HIRED TO DO.,9,2017
4451,MANY AUSTIN RESIDENTS SUPPORT SB4!,7,2017
4452,QUIT WASTING TAX DOLLARS TO SUPPORT ILLEGAL IMMIGRANTS.,7,2017
4453,QUIT WASTING TAX DOLLARS ON EVERY BLEEDING HEART CAUSE.,7,2017
4454,PROPERTY TAXES ARE OUT OF CONTROL BECAUSE OF THE CITY COUNCIL'S WASTEFULNESS.,7,2017
4455,Mass transit,2,2017
4456,Mass transportation options need to be expanded/added in order to minimize traffic congestion.,5,2017
4457,"More bus stops with parking lots, light rail, and better bike lane systems at least.",5,2017
4458,There are 3 in my family who all drive separately and at different times into downtown because there is no nearby bus stop or parking near the closest stop.,5,2017
4459,We would all take the bus daily if we could!,5,2017
4460,"MAYOR ADDLER, YOU REPRESENT AUSTIN IN THE BEST WAY POSSIBLE.",5,2017
4461,THANK YOU,5,2017
4462,Mayor Adler should make inquiries in regards to the COA employee retirement.,5,2017
4463,As to why we haven't had a cost of living increase since 2003.,5,2017
4464,Some of us are too sick or to old to work for supplement wages.,5,2017
4465,Thanks.,5,2017
4466,"MAYOR ADLER, I APPRECIATE YOUR ELOQUENT RESPONSE TO THE EMAIL CRITICIZING ALAMO DRAFTHOUSE FOR ITS ALL-WOMEN SHOWING OF WONDER WOMAN.",5,2017
4467,"ALSO, JUNE TENTH SHOULD BE A CITY-WIDE HOLIDAY.",5,2017
4468,"Mayor Adler, I wish you would be aware of the rapid expansion in this city and get more input from residents.",4,2017
4469,"Otherwise, you are doing a great job!",4,2017
4470,Keep it up!,4,2017
4471,"Mayor Adler, PLEASE help with the traffic situation!",8,2017
4472,"We put so much money into bike lanes and trails that go predominantly unused, while so many of us are robbed of precious time with our families while sitting on Mopac/I35/183 for over an hour, twice a day.",8,2017
4473,Mayor is too liberal,10,2017
4474,"Mayor
Keep up with good work.",8,2017
4475,we are crazy and unsatisfied people,8,2017
4476,"Mine would be the same as everyone else, the roads have got to be completed.",6,2017
4477,This has been going on for too long.,6,2017
4478,"The construction creates frustration, anger, and wrecks.",6,2017
4479,Mitigating traffic problems,8,2017
4480,MOPAC - You all should be ashamed of yourself!,10,2017
4481,"Pathetic; too long, too messy, too stressful, too costly and never ending.",10,2017
4482,You should be required to be on it four times a day.,10,2017
4483,You all appear clueless and unappreciative.,10,2017
4484,Mopac @ Lacrosse and Slaughter need under/over pass before I-45 opens up from Mopac to 1626.,8,2017
4485,"MOPAC IMPROVEMENT PROJECT A DISASTER, TOLLS AND TOLL COMPANIES UNETHICAL, ENCOURAGE BUSINESS TO ALLOW FOR ALT, HOURS AND REMOTE WORK TO EASE TRAFFIC CONGESTION, BIGGEST PROBLEM IN AUSTIN=GROWTH TOO FAST, NOT ADEQUATE INFRASTRUCTURE TO SUPPORT GROWING AUSTIN IS A GREAT PLACE TO LIVE BUT I WORRY ABOUT INFRASTRUCTURE, AFFORDABILITY AND TRAFFIC",7,2017
4486,"MOPAC TOLL ROAD DOESN'T EVEN MAKE SENSE FROM A LOCATION ""EXIT"" STANDPOINT.",8,2017
4487,"THERE NEEDS TO BE MORE OPTIONS, NO NEED TO USE IT IF I DON'T NEED TO EXIT PARMER",8,2017
4488,"more affordability, no more shopping centers, no more making older neighborhoods new... gentrification",8,2017
4489,More affordable housing,4,2017
4490,"More affordable housing, better utility billing, services and infrastructure.",1,2017
4491,Real traffic solutions to major roadways.,1,2017
4492,More affordable prices for apartments.,2,2017
4493,1200 for 2 bedroom.,2,2017
4494,Really.,2,2017
4495,Rent a house 1600+ for a 3bedroom.,2,2017
4496,So much help got low income and nothing for middle class that go to work Everyday to provide for family.,2,2017
4497,You can live here because you make $200 a year to much.,2,2017
4498,Really.,2,2017
4499,But people that are lazy and just having kids to keep on the system get really low rent or free rent not fair.,2,2017
4500,"More affordable, quality space for artists!",9,2017
4501,Rising rent and property taxes are quick doing away with the infrastructure that allow Austin to be the cultural center it prides itself on being.,9,2017
4502,"More space (and more affordable, quality housing) means more artists, more artwork of all mediums, and a more culturally diverse and enriched city.",9,2017
4503,MORE AGGRESSIVE INFRASTRUCTURE SPENDING ON MAJOR CITY STREETS.,7,2017
4504,MORE ATTENTION TO AFFORDABLE HOUSING FOR FAMILIES,4,2017
4505,MORE BIKE AND TRANSIT ON MARTIN LUTHER KING AND 183.,1,2017
4506,MORE BIKE LANES,9,2017
4507,MORE BIKE LANES,7,2017
4508,MORE BIKE LANES ON 2222 AND NW AUSTIN PLEASE.,10,2017
4509,ALSO MORE RUNNING TRAILS AND AN UP-DATE LISTING ON AUSTIN GOVERNMENT WOULD BE GREAT!,10,2017
4510,THANK YOU.,10,2017
4511,"More bike lanes, bus should carry more bikes",7,2017
4512,More books for library,5,2017
4513,More buses,1,2017
4514,MORE BUSES AND MORE ACCURATE SCHEDULE.,5,2017
4515,NEED SOWNTOWN BUS TERMINAL!,5,2017
4516,NOW!,5,2017
4517,PLEASE!,5,2017
4518,"More crosswalks, crossing lights, and improved/maintained sidewalks.",1,2017
4519,"Some neighborhoods have such poorly maintained, overgrown sidewalks that they aren't even accessible.",1,2017
4520,"MORE CULTURAL DIVERSITY, FESTIVALS, FOOD, MUSIC, AFFORDABILITY, NEIGHBORHOODS",9,2017
4521,MORE EDUCATION FOR FIRST TIME HOME OWNERS ABOUT PROPERTY TAXES,4,2017
4522,"MORE EFFECTIVE PUBLIC TRANSPORTATION, BETTER BIKE LANES.",8,2017
4523,IT IS SO DANGEROUS THE WAY BIKES ARE ALL OVER THE PLACE RIGHT NOW.,8,2017
4524,PLAN FOR FUTURE EXPANSIONS AT THE AIRPORT (IT'S COMING)!,8,2017
4525,"MORE FOCUS ON MASS TRANSIT,LESS ON HIGHWAYS.",7,2017
4526,WORK ON BUS ROUTES WITH WALKING DISTANCE THAT FEED TO LARGER NETWORK.,7,2017
4527,More focus on science in education,2,2017
4528,More green energy subsidize choices,2,2017
4529,"More housing density in the city core is a good thing, don't let the NIMBYs win.",4,2017
4530,MORE HOUSING FOR SENIOR CITIZEN'S ON FIXED INCOME.,7,2017
4531,MORE HOUSING FOR SINGLE FAMILY UNITS NEARBY EXCELLENT SCHOOLS.,10,2017
4532,More lighting on Mopac in North Austin.,6,2017
4533,"More public pools in the North Austin area, so we don't have to travel to the South side, it seems the South side has more activities and more fun things to do than the North side.",6,2017
4534,"More money should be directed towards affordable housing, abating traffic congestion, and addressing climate change (water conservation, public transportation, etc.).",3,2017
4535,More neighborhood facilities for senior citizen activities.,6,2017
4536,More officers with mental health training.,7,2017
4537,More planning and zoning.,8,2017
4538,Better and increased parks and hike and bike.,8,2017
4539,"Make Austin more affordable and attractive for retirees, who like musicians and artists are being priced out of Austin.",8,2017
4540,MORE POLICE PROTECTION.,3,2017
4541,RELOCATE HOMELESS CAMPS.,3,2017
4542,"More police, more effort to reduce homeless population",1,2017
4543,More public transportation (light rail or subway) to help with traffic congestion.,8,2017
4544,"MORE PUBLIC TRANSPORTATION, BIKE FRIENDLY, PEDESTRIAN FRIENDLY",3,2017
4545,More recycling programs,3,2017
4546,more resources for parks,3,2017
4547,More roads are not the answer.,8,2017
4548,Multi-modal transportation and dedicated bus lanes will help tremendously.,8,2017
4549,Re-start light rail discussions to ABIA and SW Austin!,8,2017
4550,MORE SHADY BIKE PATHS PLEASE.,2,2017
4551,MORE SIDEWALKS,6,2017
4552,more sidewalks and bike lanes on the east side,1,2017
4553,"MORE SIDEWALKS,MORE BIKE LANES,MORE WALKABLE AND PEDESTRIAN FRIENDLY NEIGHBORHOODS.",4,2017
4554,More support for bike to work,9,2017
4555,"MORE SUPPORT ON TAXES TO BUILD MORE FACILITIES, BOAT HOUSES, FOR YOUTH PROGRAMS, KAYAK/CANOE/PADDLING FACILITIES.",10,2017
4556,MORE THAN 1 GARBAGE PICK UP A WEEK.,4,2017
4557,MORE AFFORDABLE HOUSING FOR YOUNG PEOPLE WHO CAN'T GET AN APARTMENT.,4,2017
4558,"MORE WORK LESS TALK, FASTER INSPECTIONS AND REPLY ON PERMIT, THE PERMIT COMMITTEE IS HORRIBLE, TRYING TO GET WORK DONE ON OUR HOME AND INVESTMENTS IS A JOKE WHEN IT COMES TO DEALING WITH THE CITY",3,2017
4559,Move Austin City festival to the racetrack.,7,2017
4560,Do not encourage pro sports teams in Austin.,7,2017
4561,"Do not give public money to the racetrack, sports teams, etc.",7,2017
4562,"Move drunks, bums, addicts and the nasty shelter out of the city.",9,2017
4563,They are a dangerous blight on the city that hurt and scare people that live and visit downtown.,9,2017
4564,Crackdown instead of making it comfortable.,9,2017
4565,move people away from here city,2,2017
4566,"Move the ARCH and other homeless services out of town , it blights this city.",8,2017
4567,"Get rid of illegals, cooperate with INS, stop catering to bicycles, fix the local streets",8,2017
4568,MR MAYOR: PLEASE STOP OR AT LEAST SLOW ALL NEW DEVELOPMENT TO ALLOW TIME TO DEVELOP SUSTAINABLE GROWTH PLAN!!,3,2017
4569,JUST SAY NO!!,3,2017
4570,"Mr. Mayor, I have lived in Austin all my life (44 yrs.)",3,2017
4571,born and raised here.,3,2017
4572,"I have to tell you this city is not the same, Yes, change has to happen but there is I difference between change for the better of the city, for the community, and selling out.",3,2017
4573,which is what I feel that our city is doing.,3,2017
4574,justify half a million dollars for a house in 78702 zip code.,3,2017
4575,Justify remodeling south Lamar when IH35 is so messed up.,3,2017
4576,See what I mean.,3,2017
4577,"but, No, we need to create more apartments, and run good folks out of their neighborhoods to make way for the next stupid fad that comes our way.",3,2017
4578,sell out!,3,2017
4579,My band played on your balcony one time.,9,2017
4580,You have a very nice balcony Mr. Mayor!,9,2017
4581,"MY BICYCLE WAS STOLEN AT WALMART ON 5017 W US 290 HWY, AUSTIN, 78749",8,2017
4582,My house floods because the drainage system is inadequate.,7,2017
4583,my husband & I (&new baby) would love to buy a home in Austin but probably not be able to because of the high property taxes and overvalued home prices.,6,2017
4584,We are renting right now and will most likely buy outside of Austin.,6,2017
4585,MY HUSBAND AND I FELL IN LOVE WITH AUSTIN 30 YEARS AGO.,7,2017
4586,"WE STILL LOVE AUSTIN, BUT LATELY WE WORRY THAT YOUNG 20 SOMETHINGS WON'T BE ABLE TO AFFORD HOUSING.",7,2017
4587,My main concern the last several years is how much my property taxes have risen.,6,2017
4588,I am a retired teacher on a fixed income and have begun to think I will not be able to afford to keep my house and continue to live in Austin.,6,2017
4589,"I have heard the mayor and city council talk about this problem, but have not seen any relief.",6,2017
4590,"I realize that I also have the taxes from Travis County, AISD and others that are included in my bill.",6,2017
4591,I wish there was a way for the different entities to work together to balance out the hikes from year to year.,6,2017
4592,My neighborhood is not safe for children because of Pit Bulls.,2,2017
4593,The City has to rid the area of these vicious animals.,2,2017
4594,Children can't play in parks or ride bikes in fear of attack by these dogs.,2,2017
4595,Even at Odom-grades K-5 there are people training their pit bulls on the playground.,2,2017
4596,This borders on craziness .,2,2017
4597,These dogs have to be taken off the streets.,2,2017
4598,Enact a law to make them illegal.,2,2017
4599,Favor the kids not the adults with these animals that threaten defenseless kids.,2,2017
4600,My only complaint is that last year I experienced computer fraud in which it appeared as if all my money was taken.,7,2017
4601,I straightened that out and followed up by calling the Fraud Department of law enforcement more than once.,7,2017
4602,They never returned my call.,7,2017
4603,When I finally got someone they insisted they had called me back.,7,2017
4604,I had not left my house and they left no message in my voice mail so I gave up.,7,2017
4605,Need a metro rail system.,9,2017
4606,Need a Target downtown.,9,2017
4607,need affordable apartments,6,2017
4608,Need affordable housing,3,2017
4609,need affordable housing,2,2017
4610,"Need affordable housing for all, housing way too expensive, taxes way too high - what is happening to quality of life for residents that are permanent members of the city.",9,2017
4611,"NEED AFFORDABLE HOUSING, TOO MUCH RAPID GROWTH, EVERY EMPTY SPACE THERE IS A BLDG, TAXES WAY TOO HIGH FOR PEOPLE ON FIX INCOME AND THE PEOPLE NOT ON FIXED INCOME",1,2017
4612,NEED BETTER ROAD PLANNING.,7,2017
4613,TRAFFIC IS CRAZY.,7,2017
4614,STOP PLACING TOLL ROADS ON ROADS I'VE PAID FOR WITH MY TAXES.,7,2017
4615,Need concerted effort to keep low and middle income people in the city.,7,2017
4616,NEED FOR BETTER PUBLIC TRANSPORTATION A TRAIN SYSTEM TOO MANY CARS ON THE ROAD ESP TRAFFIC ACCIDENTS,3,2017
4617,Need for true affordable housing & better incentives for developers,3,2017
4618,Need I 35 expansion.,1,2017
4619,need improved bus routes,1,2017
4620,Need minimum wage to be higher.,4,2017
4621,Affordable housing for young adults,4,2017
4622,Need monorail to airport.,10,2017
4623,"Better public transportation, Clean up all the trash",10,2017
4624,Need more AFFORDABLE housing for people like me who have a job with a decent income where the neighborhoods are safe and have the same services the upper income areas have.,2,2017
4625,"Clean streets, lighted areas, good parks.",2,2017
4626,One area of town shouldn't be neglected because all the focus and money is used  to make downtown beautiful to bring in out of state money.,2,2017
4627,"In the meantime being a now single woman, I cannot afford to live in the nicer areas of Austin because the cost of rent is ridiculous!",2,2017
4628,So I'm forced to live in a high crime area.,2,2017
4629,"Need more cross walks, especially Manor Road east of 35 to airport",1,2017
4630,NEED MORE NEIGHBORHOODS NOT CONDOS.,3,2017
4631,BRINGS IN TOO MANY PEOPLE AND MORE TRAFFIC.,3,2017
4632,NEEDS MORE SKATE PARKS ON THE EAST SIDE.,3,2017
4633,Need more public transport in NE Austin.,1,2017
4634,NEED MORE SIDEWALKS IN OUR NEIGHBORHOOD AS THERE ARE MANY YOUNG KIDS HAVING TO RIDE THEIR BIKES IN THE BUSY STREET!,3,2017
4635,Need one story houses,9,2017
4636,need sidewalks on all streets,4,2017
4637,"Need smart traffic lights @ Brodie and Sil Oak, left turn especially",5,2017
4638,Need to enact city wide population growth control.,10,2017
4639,Need to fix our streets and ensure maintenance and new development projects are completed at reasonable cost and in a reasonable amount of time.,5,2017
4640,Need to invest more in infrastructure and services.,7,2017
4641,Need to lower property taxes and use the money collected more effectively.,8,2017
4642,Need to promote ride sharing throughout Austin to help minimize the amount of cars on the road there an economic partnership with rideshare companies.,4,2017
4643,"If Austin partnered with ride share companies in an effort to promote ride share it would result in: fewer cars on the road, fewer emissions from cars, fewer pollutants such as trash/oil/debris on roads, more jobs created, lower DWI/DUI arrests, lower traffic accident mortality rate as well as frequency of accidents, lower congestion, increase tourism numbers, improve parking downtown and at other city centers.",4,2017
4644,The most beneficially result of increased ride share activity would be lowering the amount of time the average citizen spends in traffic which will increase the economic utility of every citizen.,4,2017
4645,More efficient travel will help lower the costs to local transportation companies resulting in higher margin or lower prices.,4,2017
4646,Need to solve traffic issues and affordability if housing.,6,2017
4647,need tree trimming so can see signs,1,2017
4648,"Pave our neighborhood streets with asphalt instead of ""faulty"" tar and gravel - our streets look awful!",6,2017
4649,Pavement is in bad shape,7,2017
4650,PAY ATTENTION TO THE NEEDS OF THE TAXPAYERS IN THE CITY AND STOP CATERING TO LOW INCOME AND HOMELESS.,6,2017
4651,TAXES ARE WAY TOO HIGH!,6,2017
4652,Pay rates do not allow for medium income folks to move here.,1,2017
4653,This hurts UT's ability to attract the best in the fields.,1,2017
4654,Reducing UT as one of the best universities in the USA.,1,2017
4655,Paying To much taxes  and wastewater services and water service y utility,1,2017
4656,"People asking for money, especially children at Airport and MLK",1,2017
4657,Neighborhoods have too much control in Austin.,9,2017
4658,They are anti-growth and they don't want poor people living near them.,9,2017
4659,We live in a transition neighborhood and are invested in our neighbors and their ability to afford their homes.,9,2017
4660,Austin is unaffordable for many.,9,2017
4661,"We are lucky to be able to own our home, but we are only a paycheck away from being unable to afford to live in Austin.",9,2017
4662,This is the reality of many.,9,2017
4663,"I believe if we had more access to affordable housing, combined with denser, greener growth Austin would become more affordable for many.",9,2017
4664,"The parks, trails, and people of Austin are what makes it great to live in this city.",9,2017
4665,Austin is the only place I would live in Texas -- I particularly like the smell of the fresh air.,9,2017
4666,We can do better for our city and that starts with limiting the amount of influence certain organizations have over city leadership.,9,2017
4667,"Also, traffic is terrible.",9,2017
4668,It is because of the anti-growth mentality that we've waited decades to make meaningful investments in our roads an infrastructure.,9,2017
4669,That is not enough.,9,2017
4670,We need a mass transportation system that is not on the roads.,9,2017
4671,NEW NEIGHBORHOODS SHOULD BE FORCED TO HAVE A PARK WITHIN A CERTAIN DISTANCE OR MUST INCORP.,8,2017
4672,INTO DESIGN OF NEIGHBORHOOD.,8,2017
4673,NO MORE DISCRIMINATING LAWS,7,2017
4674,NO MORE SANCTUARY CITY,5,2017
4675,No Rail options.,7,2017
4676,"Austin's terrible traffic would improve with more sidewalks, lanes.",7,2017
4677,No sanctuary city.,5,2017
4678,Obey the law.,5,2017
4679,"No segregation of religious, secular, racial, economic groups",3,2017
4680,NORTH LAMAR BLVD HAS CONSTANT POTHOLES AND SEEMS TO BE IGNORED WHEN IT COMES TO MAINTENANCE.,7,2017
4681,IT REALLY NEEDS TO BE KEPT UP.,7,2017
4682,Not a Sanctuary City,10,2017
4683,"Not seeing the value of our added taxes, especially when considering our rapid growth, meaning more money coming in.",8,2017
4684,NOT to allow construction companies to work from 12 midnight until 7 am!!!,9,2017
4685,I'm getting no sleep AND the are allowing the city to WAY over build!!,9,2017
4686,There is nothing unique about Austin anymore.,9,2017
4687,It's like every other city.,9,2017
4688,"Too bad, that's why people moved here!!!",9,2017
4689,"The ""Keep Austin Weird"" logo no longer applies.",9,2017
4690,Nothing,7,2017
4691,Nothing,2,2017
4692,Nothing,7,2017
4693,Nothing,2,2017
4694,Nothing .stay fair in all that you are responsible for.,3,2017
4695,NUMBER OF VAGRANTS AT MOST STREET CORNERS SHOULD BE REDUCED.,10,2017
4696,THEY ARE A TRAFFIC HAZARD AND LEAVE GARBAGE EVERYWHERE.,10,2017
4697,OBEY NATIONAL & STATE LAWS.,8,2017
4698,GET OUT OF THE UTILITY BUSINESS.,8,2017
4699,OFFSET CORPORATE AGENDA FOR AUSTIN; DEVELOPMENT PLAN WITH MORE INPUT FROM CITIZEN'S GROUPS AND HEALTH ORGANIZATIONS.,4,2017
4700,Open the City Manager selection process.,6,2017
4701,Our cars and our neighbors cars have been hit by drunk drivers in the past several months.,4,2017
4702,"In the past 3 months, 5 of our neighbors, as well as ourselves, were hit in the middle of the night between 12:30 - 3:00 a.m.
Each vehicle was totaled or pretty close to that.",4,2017
