id,text,district,year
1623,People speed through the residential neighborhoods and do not drive 25 which would help reduce accidents or animals being run over.,9,2016
1624,I have lost 3-4 over the years.,9,2016
1625,Would like slower speeds limits in residential neighborhoods and enforced.,9,2016
1626,Thanks!,9,2016
1627,"PERMITTING IS A DISASTER, MAJOR CONSTRAINT",9,2016
1628,Pet Peeve.,4,2016
1629,"With traffic in Austin as it is, yet seems that streets are constantly closed for racing events.",4,2016
1630,Plan AHEAD for traffic growth!!,10,2016
1631,"PLAN AND DO FOR QUALITY,NOT QUANTITY TO LOWER TAXES.",10,2016
1632,Plan better for traffic in the future.,8,2016
1633,PLAN EFFORTS TO IMPROVE THE MOVEMENT OF PEOPLE IN AUSTIN AREA.,5,2016
1634,Plan growth where we need it & want it.,10,2016
1635,"Plan on more roads that run east and west of the city, between ih35 and mopac",6,2016
1636,Plan out the growth for Austin as the city grows.,5,2016
1637,The future depends on it and with this rate of change we don't have much time.,5,2016
1638,PLEAS WORK WITH APD TO TRAIN ORFFICERS TO DE-ESCALTER,2,2016
1639,Please  clean up and broaden city sidewalks and expand walking trail/biking trails.,7,2016
1640,Please  please reevaluate the Imagine Austin plan which is allowing out of town investors creating PUDs in our beloved neighborhoods without giving much thought nor care to the existing residents.,10,2016
1641,"Even having gone through neighborhood charities, the takeaway is that they are only going through the motions and will drag out the process to eventually build whatever they want at the expensive of nearby neighborhoods.",10,2016
1642,"Please ""un-gerrymander"" our election districts.",6,2016
1643,City of Austin is diluted & divided by rural edges.,6,2016
1644,PLEASE ADD MORE PERSONNEL TO HANDLE UTILITIES CUSTOMER SERVICE.,7,2016
1645,WEBSITE THE WAIT IS TERRIBLE.,7,2016
1646,"please address the issue of cars with sound systems that are a distraction and annoyance while on the road,  add to noise pollution in the city and disrupt the peace in residential areas  and prevent people from being able to sleep.",6,2016
1647,PLEASE ADDRESS THE TRAFFIC CONGESTION,4,2016
1648,Please address traffic on I35 and Mopac.,5,2016
1649,Discount  I30 toll for big rigs  and make the new toll lane on Mopac a regular lane to help with traffic flow 24-7.,5,2016
1650,PLEASE AIM FOR GREEN ROOF OR SOLAR ROOFS.,10,2016
1651,LIKE IN FRANCE.,10,2016
1652,Please ban short term rental (AIRBNB and Home away) or come up with new laws.,9,2016
1653,We live in a small condo complex in a neighborhood that was once quiet.,9,2016
1654,The unit upstairs is being used as a STR.,9,2016
1655,"Furthermore, the house next door is rented out through AIRBNB.",9,2016
1656,There is constant traffic and noise pollution.,9,2016
1657,HOA will do nothing about the situation in our condo complex.,9,2016
1658,"Furthermore, the house next door is constantly throwing parties.",9,2016
1659,We called 311 for over a year regarding after hours noise violations.,9,2016
1660,Nothing is being done and the unit upstairs continues to operate as a STR even after over a year of complaining.,9,2016
1661,This is a historic residential neighborhood.,9,2016
1662,Homeowners are being victimized.,9,2016
1663,Neighborhoods and hotels are separated for a reason.,9,2016
1664,The city council voted to ban STR but not till 2020.,9,2016
1665,How are homeowners supposed to live under these conditions?,9,2016
1666,I am sure this comment will either be laughed at or ignored.,9,2016
1667,"However, unless you are faced with these conditions, you will never understand what it feels like.",9,2016
1668,It is horrific.,9,2016
1669,"Please be sure we have top notch police, fire & medical services.",6,2016
1670,Please clean up creek beds & neighborhood streets & remove dead leaves in your right of way & city owned property.,7,2016
1671,Please compost!,10,2016
1672,Please consider providing either a reliable park and ride system or light rail system in the future.,6,2016
1673,I'm astounded at how much my property taxes have increased over the past couple of years.,6,2016
1674,I would like to gave seen the money I paid go towards improving our traffic  structure/management both in and around downtown Austin.,6,2016
1675,Please consider setting limits to the development growth of Austin (urban sprawling).,10,2016
1676,"This is a déjà-vu of what happened in Northern California in the nineties, where every patch of grass was developed.",10,2016
1677,"Austin has a unique charm, with high quality customer service,  and great quality of life that will quickly deteriorate with this rapid urban sprawl.",10,2016
1678,"It's wonderful that everyone loves Austin, but let's develop the suburbs, because at this rate we will lose what makes Austin .",10,2016
1679,Please cut the budget.,3,2016
1680,Please lower taxes.,3,2016
1681,We don't need pretty streets or arts in the park if we can't afford to remain in our homes.,3,2016
1682,Please do not provide 24 hour notice of restaurant inspections!!,10,2016
1683,"Please enforce watering restrictions, this is doable.",10,2016
1684,"Please fix building permit processes, it's crooked!",10,2016
1685,"Please do something about the traffic, (especially 35 & Mopac).",5,2016
1686,Please do something about these city streets!,1,2016
1687,They cause motorists to suffer the cost for repairs due to the terrible street conditions.,1,2016
1688,PLEASE DO SOMETHING ABOUT TRAFFIC!,2,2016
1689,TOO MANY CARS ON ROADS BUILT TO HANDLE LESS TRAFFIC.,2,2016
1690,Please do something to improve traffic.,4,2016
1691,"Please do what you can to keep Austin affordable for the middle class (most importantly in home ownership), enforce codes (i.e. construction should NOT be happening on Sunday), and keep those roads moving!",5,2016
1692,Thank you for all you do.,5,2016
1693,Please don't change the zoning of our single family neighborhood to allow for multi-family structures.,7,2016
1694,I live close to Burnet Rd.,7,2016
1695,and have heard about the implications of Code Next and am quite unhappy about the possibility of row houses going up next door.,7,2016
1696,People who own homes in this town have rights that shouldn't be diminished because developers want to profit and build over what we used to know as Austin.,7,2016
1697,"We are taxed at such high rates (thanks, legislature), but have this encroachment as an added insult.",7,2016
1698,We will have to move out of the neighborhood and possibly the city when we retire simply because of taxes (and perhaps row houses).,7,2016
1699,"As a native Austinite, that stings.",7,2016
1700,The dollars that we will get for our home some day can't replace the feeling of connection to our community we've invested so much time in that will be lost when we can no longer live here.,7,2016
1701,Please don't make us pay %5/month for composting.,7,2016
1702,Please don't tax me out of my home,5,2016
1703,Please don't turn mopac  into an alternative to 35.,7,2016
1704,"I love Barton Springs, and don't want the extra traffic over the recharge zone.",7,2016
1705,Thanks!,7,2016
1706,Please enforce hands-free initiative/ordinance.,6,2016
1707,Please evaluate methods of conducting business with city--methods and means.,10,2016
1708,Please fix my street!,7,2016
1709,5705 Nasco,7,2016
1710,PLEASE FIX THE MAJOR ROADS BEFORE ANOTHER BICYCLE LANE OR SIDEWALKS IS ADDED OR REPAIRED.,9,2016
1711,ENOUGH IS ENOUGH.,9,2016
1712,Please fix the MAJOR TRAFFIC PROBLEM by staying ahead of the game - QUIT PLAYING CATCH UP!!!!!!!!!!!!!!,9,2016
1713,Provide AFFORDABLE HOUSING FOR ALL LEVELS OF INCOME and LOWER PROPERTY TAXES!!!!!!!!!!!!!!!!!!!!!!!!!!,9,2016
1714,"Please fix the traffic and stop the construction, we need green spaces.",6,2016
1715,Please fix the traffic flow in and around this city.,6,2016
1716,I-35 & Mopac are horrendous!!,6,2016
1717,Please fix the traffic problems!,9,2016
1718,"PLEASE FIX THE TRAFFIC PROBLEMS, TOLL ROADS ARE NOT THE ANSWER",2,2016
1719,Please fix the traffic problems.,4,2016
1720,"I would love to see a light rail system that accessed more areas of the city, as well as the airport.",4,2016
1721,"Look to Denver, CO for an example of a useful rail system.",4,2016
1722,PLEASE FIX THE TRAFFIC SITUATION.,2,2016
1723,PLEASE FIX THE TRAFFIC SITUATION.,10,2016
1724,WE ARE NOT A SMALL CITY ANYMORE.,10,2016
1725,STOP MAKING AUSTIN KEEP PEOPLE FROM MOVING HERE.,8,2016
1726,Please fix the traffic.,7,2016
1727,We need more north south corridors.,7,2016
1728,We need more ways across the river.,7,2016
1729,"Please fix the transportation issues in Austin for CARS - i.e. - create rail to get some off the road/build more roads to handle those that are on the road, along with other things like sidewalks and bike lanes.",10,2016
1730,If this is not resolved Austin will no longer be a great place to live.,10,2016
1731,PLEASE FIX TRAFFIC,3,2016
1732,PLEASE FIX TRAFFIC AND BUILD SH45,5,2016
1733,PLEASE FOCUS ON GROWING A DYNAMIC URBAN ENVIRONMENT FOR PEDESTRIANS LESS ON MOVING CARS AROUND QUICKER.,1,2016
1734,Please focus on increasing the supply of all types of housing within the core of Austin.,7,2016
1735,"10,000 units per year of the next 10 years.",7,2016
1736,PLEASE FOCUS ON THE TRAFFIC ISSUE.,7,2016
1737,IT IS MAKING AUSTIN UNBEARABLE.,7,2016
1738,PLEASE FOSTER POPULATION CONTROL FOR QUALITY OF LIFE,3,2016
1739,"Please fund Austin Police Department, fire and EMS.",7,2016
1740,You do NOT need to fund a bunch of special interest projects!,7,2016
1741,Please get the ARCH and the homeless out of the downtown end.,9,2016
1742,district.,9,2016
1743,PLEASE GET THE TRAFFIC SITUATION IMPROVED AND THE SHOAL CREEK FLOODING FIXED,9,2016
1744,PLEASE GIVE THE AQUATICS DEPT A NEW OFFICE BUILDING.,10,2016
1745,I TOOK MY SON TO SIGN UP AS A LIFEGUARD I WAS SHOCKED.,10,2016
1746,Please have Austin Energy trim tree branches near power lines.,1,2016
1747,Please help all the people in east Austin loosing their home,3,2016
1748,Please help ease traffic congestion!,8,2016
1749,Please help keep our new streets clean and enforce speed limits.,2,2016
1750,Please help make the city safer!,6,2016
1751,"In the past several years, perhaps because of all of the out of towners, we've experienced multiple incidents that make us feel Austin is not as safe as it was in the 90s-00s.",6,2016
1752,"For example, the rearview window of our car was broken when we were out recently (I think it happened to many cars in Lakeline Mall that weekend, though we weren't at the mall).",6,2016
1753,"Downtown is much less safe; ""dirty Sixth"" is really dirty now with fights and even gun violence!",6,2016
1754,We are concerned about these issues for the safety of our family and community.,6,2016
1755,PLEASE HELP PROTECT OLDER NEIGHBORHOODS FROM TEAR DOWN.,5,2016
1756,OLD FOLKS NEED OUR HOMES.,5,2016
1757,"Please help provide Better street lighting in East Travis Heights i.e. woodland ave, and fix major 9 year drainage problems on street in East Travis Heights- woodland avenue and royal crest intersection.",3,2016
1758,Please help the Animal centers with funding for better facilities.,5,2016
1759,"Please help with catch, neuter and release of feral animals such as cats.",5,2016
1760,please help with the traffic!,8,2016
1761,and giving incentives to companies to have people work from home or car pool.,8,2016
1762,Like,8,2016
1763,PLEASE HELP WOMEN OWN BUSINESS.,10,2016
1764,PLEASE IDENTIFY AUSTIN CULTURE LIVE MUSIC.,3,2016
1765,Please improve / revamp the light rail service.,6,2016
1766,"It should cover important city areas like UT campus, Downtown, ABIA.",6,2016
1767,"That would take a lot of traffic off I-35, Mopac and 183 instead widening with toll roads such highways.",6,2016
1768,Austin will keep growing and with that we will have more cars on those roads and you can't keep adding lanes forever.,6,2016
1769,Please improve bike accessibility and fix the automotive traffic nightmare!,9,2016
1770,Please improve the roadways.,8,2016
1771,"Please, please develop a metro rail system.",8,2016
1772,PLEASE IMPROVE TRAFFIC CONGESTION AND CAP METRO RELIABILITY.,7,2016
1773,Please improve traffic flow!!!,6,2016
1774,Please increase curbside recycling services pickup frequency.,6,2016
1775,"We are doing our part to recycle but our recycle bin fills in one week, our waste bin fills in 2-3 weeks.",6,2016
1776,I would opt to have recycling picked up every week along with the trash pickup schedule.,6,2016
1777,Please increase the number of badged police officers to improve both public safety and community policing efforts.,7,2016
1778,MORE BIKE LANES,9,2017
1779,MORE BIKE LANES,7,2017
1780,Please intentionally reach out to the faith community for their views on critical issues facing our city.,7,2016
1781,Please invest in building out our public transit system.,7,2016
1782,"Yes, it is a very expensive endeavor, but it will only get more expensive in the future.",7,2016
1783,It is also a major contributing factor to the affordability problem in Austin.,7,2016
1784,"Until we build out our public transit system, we will not be able to build to the density required to provide affordable housing in the city limits.",7,2016
1785,Rail or gondolas or dedicated lanes for the bus system.,7,2016
1786,"Please invest in something that isn't car-based, because car-based investment can only become prohibitively congested long before we've reached the density to attempt any sustainable solution to our affordability crisis.",7,2016
1787,Please.,7,2016
1788,Thank you.,7,2016
1789,Please keep a vigil in moving forward the Barton Springs pool master plan.,5,2016
1790,Please keep adding bike lanes and please protect our parks and historical sites.,4,2016
1791,PLEASE KEEP AUSTIN AFFORDABLE NO MORE CONDOS.,1,2016
1792,DEVELOPMENT JUST FOR RICH PEOPLE.,1,2016
1793,PLEASE KEEP AUSTIN WEIRD DON'T DESTROY PLACES LIKE SEKRIT THEATER ON THE EAST SIDE,9,2016
1794,Please keep grass mowed along sidewalks.,6,2016
1795,"Please keep housing affordable for artists, minorities, low income, young people, and keep Austin diverse!",1,2016
1796,PLEASE KEEP OUR SIDEWALKS CLEAR OF WEEDS ON A REGULAR BASIS,2,2016
1797,PLEASE KEEP THE COST OF LIVING IN AUSTIN AFFORDABLE SO WE CAN STAY,7,2016
1798,PLEASE LISTEN TO THE LOWER RANK EMPLOYEES DELIVERING SERVICES INSTEAD OF ADMIN,9,2016
1799,Please lower my property taxes!!!,8,2016
1800,"PLEASE MAKE AUSTIN MORE AFFORDABLE, COST OF LIVING IS RISEN FASTER THAN WAGES",8,2016
1801,Please make bicycle safety/lanes part of any new development and/or road improvements.,5,2016
1802,Thank you!!,5,2016
1803,"Please make bike lanes--bigger ones with cycle tracks.,",9,2016
1804,Please make decisions on economics not political correctness.,10,2016
1805,Tax money is not unlimited.,10,2016
1806,Priorities are the key.,10,2016
1807,"Please make effort to combat the heat, i.3.",3,2016
1808,"replace black asphalt, etc, plant more trees.",3,2016
1809,Please make it easier for new families to afford a home in Austin.,2,2016
1810,But more importantly can we please do something about all the homeless people?!,2,2016
1811,Please make sure that city employees are listened to and their opinions heard in the selection process for the new City manager.,9,2016
1812,PLEASE MAKE THEY CITY MORE WALKABLE ALONG STREETS LIKE LAMAR AND BURNET,7,2016
1813,PLEASE MAKE THIS CITY MORE BIKE FRIENDLY.,7,2016
1814,PLEASE MARK LINES ON STREETS HARD TO SEE ESPECIALLY WHEN IT RAINS.,2,2016
1815,PLEASE MORE PARKING SPACES.,9,2016
1816,PLEASE MOVE MUSICAL FESTIVALS OUT OF THE CENTER OF AUSTIN.,5,2016
1817,Please mow the sidewalks and right-of-ways in S. Austin.,5,2016
1818,"It's embarrassing to have out of town visitors ask ""why don't they mow around here?""",5,2016
1819,PLEASE PASS A LAW TO PROTECT RENTERS FROM INCREASES.,3,2016
1820,Please plan better for growth on our roadways!,5,2016
1821,Please plan for the future through investments in a comprehensive transit plan rather than quick fixes related to traffic.,9,2016
1822,PLEASE PROVIDE MORE AFFORDABLE HOUSING.,1,2016
1823,Please provide more public transportation.,1,2016
1824,PLEASE PROVIDE MORE TRANSPORTATION OPTIONS FOR SOUTH AUSTIN RESIDENTS THAT TRAVEL TO DOWNTOWN AUSTIN AND DO AWAY WITH PANHANDLERS.,5,2016
1825,PLEASE PROVIDE POLICE WITH TRAINING  WHEN DEALING WITH CITIZENS THERE IS SO MUCH LETHAL FORCED USED.,5,2016
1826,PLEASE PROVIDE SAFE FREE FACILITIES FOR OUR HOMELESS POPULATION.,7,2016
1827,Please provide safety for cyclists.,10,2016
1828,I love this city!,10,2016
1829,Great job.,10,2016
1830,PLEASE REDUCE MOWING OF PARKS AND GREEN SPACES THERE IS A GREAT BIO DIVERSITY IN THE HABITATS OF TALL GRASSES AND PLANTS.,7,2016
1831,MOWING IS DESTRUCTIVE AND UNNECESSARY.,7,2016
1832,THANK YOU.,7,2016
1833,"Please repair Guadalupe Street (southbound, especially right lane ) between 24th Street and 15th Street.",1,2016
1834,Thanks!,1,2016
1835,Please review McMansions.,10,2016
1836,You're throwing the baby out with the bathwater.,10,2016
1837,"Please show more support to the black community, especially those being displaced to the east side due to gentrification.",9,2016
1838,Please solve the traffic problems!,5,2016
1839,"Please start to understand economics, the more you spend on different programs outside of what should be city responsibilities, the more taxes go up and the more unaffordable the city becomes.",1,2016
1840,"Every dollar counts and the city seems to be fond of saying ""it will only raise taxes by a few dollars "".",1,2016
1841,We should be concerned that our city budget is that Dallas and San Antonio.,1,2016
1842,That's ridiculous!,1,2016
1843,"Please stop adding new fees, costs, etc.",10,2016
1844,to utility bills or sell Austin Energy and get rid of the monopoly.,10,2016
1845,Utility bills should only reflect the costs of that utility and not overcharge so the city can pay for other things out of general funds.,10,2016
1846,"We are in the county, but pay for items from utilities.",10,2016
1847,"If I did this in my business, I would be filling out the form out from jail!",10,2016
1848,Please stop claiming Austin is great place to live.,5,2016
1849,"It's okay... unfortunately the aspects that made Austin fun and unique have been destroyed by business greed, high property taxes, unaffordable housing, and inadequate transportation options.",5,2016
1850,Please STOP giving big businesses who come to Austin utility discounts and incentives!!,5,2016
1851,Please stop giving tax breaks and incentives to businesses to stay or move here.,6,2016
1852,Please stop over growth of city!!,1,2016
1853,It cannot handle the high number of people!!,1,2016
1854,Does not feel like Austin any more!!,1,2016
1855,Miss being able to do our Austin activities due to overcrowding!!,1,2016
1856,Please support mass transit initiatives.,9,2016
1857,PLEASE USE A DIFFERENT MUSIC BACK GROUND AT THE AIRPORT.,8,2016
1858,PLEASE WORK ON GETTING TRAFFIC SIGNALS FIXED.,5,2016
1859,PLEASE WORK ON TRAFFIC.,1,2016
1860,SOME LIGHTS STAY RED FOR A LONG TIME AND CAUSE BUILD UP.,1,2016
1861,"Please work together, not just promoting your district.",10,2016
1862,"Please, please build more libraries near the Avery ranch/parmer area.",6,2016
1863,The nearest one is Spicewoods.,6,2016
1864,We need one closer to this side of 183 and 620.,6,2016
1865,There are way too many people living/moving to this area to not have a new library near by.,6,2016
1866,Please consider building a new library near brushy creek.,6,2016
1867,It would be a perfect place.,6,2016
1868,"Please, please, please find an actual solution to all traffic issues!",5,2016
1869,Police Body Cameras to ensure the protection of the Community and Law  Enforcement.,5,2016
1870,POLICE COULD TAKE WOMEN WITH BABIES MORE SERIOUSLY,4,2016
1871,POLICE FIRE EMS TOO EXPENSIVE CONTRACTS.,3,2016
1872,Police response time in unacceptably slow.,10,2016
1873,"Police, judge, lawyers, doctors etc, need to be held accountable for their crimes just like us ordinary people",1,2016
1874,POOR REPRESENTATION BY COUNCIL.,10,2016
1875,PREMIUM FEES FOR EVENTS ARE ECESSIVE,3,2016
1876,PRESERVE AUSTINS LEGACY & MUSIC/MUSICIANS.,6,2016
1877,IT IS Crucial,6,2016
1878,Price gouging on rent and home price is going to become if not already a huge problem.,9,2016
1879,"Not sure that there is anything he can do, but he needs to be aware.",9,2016
1880,Pricing older folks out of their homes.,4,2016
1881,"Priority emergency management, need adequate police & EMS staffing to allow community involvement/relations.",10,2016
1882,"Transit is essential for ALL residents, i.e. toll lane for few whom can afford it.",10,2016
1883,"IH35 & MoPac congestion is negative for local economy and causes air pollution and causes safety hazards, i.e. dangerous to drive here.",10,2016
1884,"Privatize as many services as possible, including Social Services.",8,2016
1885,"Programs like the ""Equity office"", compost curbside pickup, meddling in the affairs of businesses like criminal check boxes, regulation of payday lenders are all expenses contributing to COA's unaffordability by a thousand cuts.",10,2016
1886,PROPERTY TAX IS A BROKEN SYSTEM.,4,2016
1887,PROPERTY TAX OUTRAGEOUS!,7,2016
1888,TRAFFIC IS HOORIBLE.,7,2016
1889,PROPERTY TAXES ARE DRIVING LONG TIME RESIDENTS WHO ARE RETIRED OUT OF THE CITY.,9,2016
1890,GROWING TOO FAST.,9,2016
1891,PROPERTY TAXES ARE OUT OF CONTROL.,10,2016
1892,STOP SPENDING MILLIONS FOR BIKE LANES.,10,2016
1893,Property taxes are outrageous.,9,2016
1894,It is time for the city to place more of the burden on businesses that make tons of money in this city and to take more of the burden away from it's residents.,9,2016
1895,$9800 a year on a 906 house is ridiculous.,9,2016
1896,PROPERTY TAXES ARE TOO HIGH.,9,2016
1897,SHOULD HAVE MORE OF A REDUCTION IF OVER 62.,9,2016
1898,PROPERTY TAXES VALUE RATES ARE TOO HIGH.,8,2016
1899,PROTECT EAST AUSTIN AND THE POOR,3,2016
1900,Protect local businesses.,8,2016
1901,PROVIDE BETTER BUS ROUTES AIMED AT FOLKS WHO HAVE ACCESS TO CARS.,7,2016
1902,BY BETTER I MEAN STRAIGHT LINES CONVENIENT TIMES.,7,2016
1903,I LIVE AT BAKER AND LAMAR BUT CAN'T TAKE A BUS THAT GOES SOUTH ON LAMAR STRAIGHT THRU.,7,2016
1904,PROVIDE FREE MATERNITY SERVICES.,1,2016
1905,PROVIDE MORE THAN ONE ENERGY COMPANY IN OUR AREA,6,2016
1906,PROVIDE PROGRAMMING TO ASSIST THE HOMELESS AND CLEAN UP THEIR LIVING AREAS UNDER ROADWAYS.,2,2016
1907,Public bathrooms and no portable bathrooms in parks and trails,7,2016
1908,Public transit is NOT good.,1,2016
1909,Getting around without a car is TERRIBLE!!,1,2016
1910,Public transport to improve Mopac Congestion,8,2016
1911,Public transportation -- more of it; can't pave our way out of growth.,5,2016
1912,Also work w companies to encourage telecommuting for employees who can to help traffic and reduce carbon footprint,5,2016
1913,PUBLIC TRANSPORTATION IS A DESPERATE NEED AND LETS PAINT ROOFS WHITE TO HELP COMBAT GLOBAL WARMING,10,2016
1914,Public transportation needs to improve.,3,2016
1915,PUBLIC TRANSPORTATION OPTIONS ARE INADEQUATE NEEDS INTENSE FOCUS.,7,2016
1916,PUBLIC TRANSPORTATION PLAN THAT WOKS.,8,2016
1917,MUST GO TO AIRPORT FIRST.,8,2016
1918,PUBLIC TRANSPORTATION!!!!!,3,2016
1919,We need an affordable rail system that also operates downtown and south.,3,2016
1920,Public transportation.,7,2016
1921,Public transportation.,1,2016
1922,Public transportation.,7,2016
1923,Public transportation.,1,2016
1924,Public wheelchair transportation to ALL areas.,6,2016
1925,PUT MORE FOCUS ON PEDESTRIANS.,3,2016
1926,WE NEED BETTER SIDEWALKS AND LIGHTING.,3,2016
1927,"Put more patrol officers on the streets and have them drive through apartment complex parking lots frequently, especially at night.",5,2016
1928,"Either do that, or legalize all drugs and free us of four-wheeled boom box illegal drug dispensaries.",5,2016
1929,PUT SIDEWALK EXTENSIONS IN OUR HARRIS RIDGE NEIGHBORHOOD,7,2016
1930,Questionable employee politics in COA Public Works HR,8,2016
1931,Quit adding bike lanes on roads,4,2016
1932,Quit all the green programs that cost more than they are worth.,4,2016
1933,QUIT BUILDING OVER POPULATING AUSTIN AND RAISING TAXES.,1,2016
1934,quit changing streets into bike lanes,3,2016
1935,Stop making Austin too expensive to live in!,7,2016
1936,"QUIT EXPECTING TAXPAYERS TO PAY FOR THOSE NOT WILLING TO WORK, IF PEOPLE WERE NOT GIVEN SO MANY FREEBIES THEY'S GET OUT AND WORK JUST LIKE` I'VE DONE SINCE I WAS 15 YRS OLD!!!!",7,2016
1937,Quit focusing on downtown and fluff efforts.,8,2016
1938,Get serious with traffic issues and get 1626 connected to 45.,8,2016
1939,Quit letting small radical groups like SOS stop needed projects and drive the cost up on everything with their environmental blanket.,8,2016
1940,Quit giving tax breaks to businesses so you can quit raising property taxes.,10,2016
1941,Quit passing laws/rules that increase our cost of living.,10,2016
1942,Composting fee?,10,2016
1943,Really?,10,2016
1944,"Electricity, trash, water, all too high now.",10,2016
1945,QUIT SPENDING MONEY ON BIKE LANES WHEN WE NEED VEHICLE TRAFFIC IMPROVEMENTS.,8,2016
1946,QUIT SPENDING MY MONEY,1,2016
1947,"Quit spending my money so frivolously
Offer incentives to local businesses as you do corporate big boys
Retail stop watering when you already had rain see this a lot at Arbor Trails 
Love the walking path and retail and restaurants design",8,2016
1948,QUIT SPENDING SO MUCH MONEY.,8,2016
1949,YOUR STUPID PROGRAMS ARE EXPENSIVE AND ARE FORCING MIDDLE CLASS OUT OF AUSTIN.,8,2016
1950,SMALLER GOVERNMENT PLEASE!,8,2016
1951,Quit the whole house subsidies for energy efficiency.,10,2016
1952,The program has become a gas subsidized program that benefits a few companies.,10,2016
1953,Heat pumps are more efficient than gas yet $1000 of the rebate comes if you burn gas.,10,2016
