id,text,district,year
3174,"The special interest groups need to be held accountable, just like we hold those civil service employees who are employed with the city agencies and not be one sided as portrayed in the media.",7,2017
3175,"I would like every citizen treated equally, regardless of race, religion, age, sexual orientation, and/or wealth or lack there of; meaning serval things to include eliminating Austin being a sanctuary city and quit giving extra resources to special interest groups (i.e. criminals, sexually oriented persons, race, bicyclist, etc.)",7,2017
3176,"that only seek out and receive special provisions because of what group they are affiliated with, having little regard to negative impact it causes on their fellow citizens' concerns.",7,2017
3177,I believe we are all equal in America and should not be given extra benefits for belonging too or associating with a particular interest group that someone who is not part of group does not receive.,7,2017
3178,"If things keep getting worse, I will end up leaving the city after 40+ years and retire in a environment that is inspired by community growth and commitment to one another, not one that is supporting criminals and people that do not contribute positively to the community.",7,2017
3179,"Austin is still weird, but getting weird in a bad way when our city politics start looking more and more like Washington D.C. or Los Angeles, CA and not the Austin, Texas I grew up in.",7,2017
3180,"AS A TAXPAYER (HIGH) IT WOULD BE NICE TO VISIT DOWNTOWN AT A FAIR PARKING RATE-NEED MORE SPACES-ENFORCE ALL TRAFFIC LAWS FOR THE ONES WHO RIDE BICYCLES-ALSO, RIDE ONLY ON THE STREETS WITH BIKE LANES-OUR TRAFFIC PROBLEM IS BAD ENOUGH.",10,2017
3181,AS AUSTIN GROWS I'M CONCERNED ABOUT TRAFFIC.,5,2017
3182,I THINK WE NEED AN IMPROVED PARK AND RIDE SYSTEM.,5,2017
3183,As great as Austin is.,2,2017
3184,Can we stop encouraging people to move here.,2,2017
3185,Our cost of living is extremely high and jobs are hard to find and wages are low,2,2017
3186,Beautiful city - I wish the river and the streets were cleaner.,8,2017
3187,Thanks!,8,2017
3188,BETTER AND MORE BIKE LANES ARE NEEDED.,3,2017
3189,"as we welcome more and more people into Austin, I think it's important to impart to them that we care about our poor citizens, care about the homeless and celebrate diversity.",3,2017
3190,I hope that the city can put its people and its beauty and history above the whims of outside investors.,3,2017
3191,I want my neighborhood to be affordable to the families that live here even though it is near downtown.,3,2017
3192,I want our city to continue to monitor and incorporate our police force into neighborhoods because I think we've been a decent example of that in recent years but it always takes work and maintenance.,3,2017
3193,Thank you.,3,2017
3194,AUSTIN IS RAPIDLY BECOMING UNAFFORDABLE AND DREADFUL TO NAVIGATE.,3,2017
3195,"THIS PUSHES OUT THE FOLKS WHO MAKE THE CITY INTERESTING, LEAVING ONLY AWFUL PEOPLE.",3,2017
3196,"Aside from the traffic of Austin getting worse each year so are the services provided for children with disabilities; everything from not having good and reliable health care services close to our community, to living in a desert of healthy, organic food area makes for raising a healthy family in Austin a great challenge that it has made us think of moving out of the city.",2,2017
3197,That's without even mentioning the rising cost of living here with how our property taxes are going up and the Austin Independent School District providing such a deplorable service in education to our children that we have had to dis-enroll them from public education and have had to home-school them.,2,2017
3198,I wish Austin kept its reputation of being a great city to be at but as the years pass we keep getting more and more disappointed in the money loving public leaders who forget who they are working for.,2,2017
3199,Austin Code Enforcement is virtually non existent,1,2017
3200,AUSTIN ENERGY IS TERRIBLE.,6,2017
3201,POWER HAS GONE OUT ON MY STREET 10 TIMES IN THE LAST 12 MONTHS.,6,2017
3202,"AUSTIN ENERGY PRICES ARE OUTRAGEOUS, WE NEED COMPETITION FOR ELECTRICITY SERVICES THIS IS A MONOPOLY",1,2017
3203,AUSTIN ENERGY SUCKS.,1,2017
3204,Everyone knows it and experiences it and multiple friends including myself have been ripped off by them.,1,2017
3205,We are SO DONE with them.,1,2017
3206,Austin has THE WORST way of doing this.,1,2017
3207,Only 1 company.,1,2017
3208,RIDICULOUS.,1,2017
3209,Austin has gone through uncontrolled growth.,6,2017
3210,Infrastructure was not developed ahead of time.,6,2017
3211,Traffic speed is among the worst cities in the world (during rush hours).,6,2017
3212,"AUSTIN HAS GOTTEN TOO EXPENSIVE TO LIVE HERE AS A HOME OWNER, TRAFFIC IS USUALLY A NIGHTMARE AFTER RETIRING WE ARE PLANNING ON MOVING OUT OF AUSTIN",2,2017
3213,Austin highway system needs long-term though.,3,2017
3214,(In next 40 years...).,3,2017
3215,"Five lanes of traffic, longer exit/entrance ramps.",3,2017
3216,"AUSTIN IS A GREAT CITY,BUT IT HAS MAJOR TRAFFIC PROBLEMS ON IT'S HIGHWAYS.",8,2017
3217,"AUSTIN IS A TRULLY GREAT CITY, I WILL NEVER LEAVE",6,2017
3218,"Austin is a very expensive place to live and lots of young people, who don't have a lot of money live here.",7,2017
3219,"Food, places to live and childcare (I am currently expecting and have no clue how I'll afford care for my child.)",7,2017
3220,are outrageous in Austin and it makes living here a huge financial struggle for anyone who isn't older and/or making a good deal of money at their jobs.,7,2017
3221,"For average people and young adults, living here leaves you with barely enough to get by.",7,2017
3222,Austin is a very fun and beautiful city to live in.,10,2017
3223,I truly enjoy and appreciate the city's efforts to conserve the city's nature and parks.,10,2017
3224,"Traffic is horrible, but I recognize the effort going into improving major highways and streets.",10,2017
3225,I am very satisfied with the city's public and private (ridesharing) transportation services.,10,2017
3226,Austin is a wonderful place to live but I really wish we had some museums.,5,2017
3227,"Art, science, history.",5,2017
3228,We're big enough that I really feel their lack.,5,2017
3229,Austin is awesome.,2,2017
3230,"But as the head of a small family looking to buy our first home, it is unfortunately too expensive which is why we will be moving south to Kyle at the end of the month.",2,2017
3231,"AUSTIN IS BECOMING INCREASINGLY UNAFFORDABLE, ESPECIALLY IN TERMS OF HOUSING.",10,2017
3232,I WORRY THAT MY CHILDREN WON'T BE ABLE TO AFFORD TO LIVE IN THIS GREAT CITY.,10,2017
3233,"Austin is doing well making it a more walkable city, but I wish Austin was developed around the people rather than cars.",10,2017
3234,"We should invest more in cycling/sidewalks which promotes a healthier and happier lifestyle, rather than investing in building bigger highways.",10,2017
3235,"Look at Norway and Denmark, or even Portland.",10,2017
3236,I also really admire Austin's goal to be zero waste by 2050!,10,2017
3237,Austin is in DESPERATE need of a loop.,5,2017
3238,It is a major metropolitan city.,5,2017
3239,The traffic is HORRENDOUS and is bumper to bumper in all the major roads from south Austin to north.,5,2017
3240,The rate of population is not keeping up with the rate of development of its roads.,5,2017
3241,This is poor planning on the part of city of Austin.,5,2017
3242,"This negatively effects the quality of life for Austin residents, and one of the main reasons why I do not see myself staying in Austin next year.",5,2017
3243,I have traveled to Lubbock TX and was able to travel from north/south Lubbock to TX Tech campus within 6 min!,5,2017
3244,I have lived in Austin almost 20 yrs and have had enough.,5,2017
3245,There'd no reason an Austin resident has to spend nearly 2-3 hours of their daily commute just trying to get crosstown.,5,2017
3246,AUSTIN IS NOT A LIVABLE CITY AND THAT'S SAD.,5,2017
3247,Austin is NOT an affordable place to live!!,7,2017
3248,This is especially true for young minorities.,7,2017
3249,This is a city of THE HAVES and THE HAVE NOTS!,7,2017
3250,Austin is not managing growth well.,8,2017
3251,There is too much development without the infrastructure to support it including the management of traffic flow and WATER.,8,2017
3252,Those of us in the suburbs have to watch as the wildlife flees or dies as development encroaches on habitat.,8,2017
3253,"We used to run regularly in Zilker park but now it's a zoo, too many people, traffic and lack of parking makes access difficult and too many events in the park and downtown.",8,2017
3254,Those of us who have to commute dread all these events that turn Austin into the playground for the wealthy.,8,2017
3255,My escalating property taxes mean I won't vote for ANYTHING that increases them no matter how beneficial for fear of being priced out of my home by the time I retire.,8,2017
3256,AUSTIN IS NOT SO UNIQUE.,9,2017
3257,OTHER CITIES HAVE FACED VERY SIMILAR CHALLENGES OF GROWTH IN THE PAST.,9,2017
3258,"Austin is one of the largest cities in the U.S., yet the mentality of many (not the mayor) seems to be that Austin is still a small college town or should remain so.",9,2017
3259,"This affects transportation planning, housing, homelessness, urban planning, renewal, diversity, etc.",9,2017
3260,"Austin will not be a great small city, but it could be a great large city if the various constituencies accept that things will not be what they were 30 years ago.",9,2017
3261,AUSTIN IS QUICKLY BECOMING A CITY WHERE AVERAGE FAMILY CANNOT AFFORD TO LIVE.,3,2017
3262,CONSTANT HIGH DOLLAR PROPERTIES BEING BUILT ARE DRIVING THE BLUE COLLAR WORKERS OUT OF THE CITY.,3,2017
3263,AUSTIN ISD RECAPTURE NEEDS TO BE FIXED!,6,2017
3264,WE SHOULD NOT BE ISSUING BONDS FOR SCHOOLS WHICH WE ALREADY PAID!,6,2017
3265,Austin isn't what it used to be and for us original Austinites it's a change that is tough to bear.,2,2017
3266,What if anything is being done to curb the influx of people from other cities/states?,2,2017
3267,The changes they bring have made the city more urban than friendly in all aspects.,2,2017
3268,AUSTIN NATIVES WITH AN EMPHASIS ON THOSE BEING PUSHED OUT OF THEIR HOMES.,10,2017
3269,WHILE IT HAPPENS HOW CAN IT BE BALANCED PROCESS FROM THE INNER CITY.,10,2017
3270,AUSTIN NEEDS A BETTER PUBLIC TRANSPORTATION SYSTEM THAT CAN ACCOMMODATE MORE PEOPLE TO HELP WITH TRAFFIC AND OVERALL GROWTH OF THE CITY.,8,2017
3271,Austin needs better public transportation,1,2017
3272,Austin needs more affordable housing,4,2017
3273,AUSTIN NEEDS TO DEVELOP A NEW IDENTITY MORE INLINE WITH ITS MODERN CONDITION,4,2017
3274,Austin Pets Alive is not the resource everyone thinks it is.,7,2017
3275,Warehousing in horrible kennels is not humane and all they do is fundraise.,7,2017
3276,Austin Police need better sensitivity and De-escalating  training.,4,2017
3277,"We need more police presence in the higher crime areas such as Rundberg/ Georgian Acres and other contiguous neighborhoods, including Heritage Hills (my area).",4,2017
3278,Austin public transportation needs to be improved.,7,2017
3279,The light rail needs to run longer and more buses need to go to more neighborhoods.,7,2017
3280,AUSTIN SHOULD NOT BE A SANCTUARY CITY!,4,2017
3281,Austin should NOT be a Sanctuary City!,10,2017
3282,Enforce out country's laws.,10,2017
3283,AUSTIN WATER/WASTEWATER LIES ABOUT READING THE METER MONTHLY AND IS HIGHLY INACCURATE.,3,2017
3284,"THERE IS NO PROGRAM TO FIX THIS, AUSTIN ENERGY DOES NADA",3,2017
3285,AUSTINS MAJOR PROBLEM IS AFFORDABLE HOUSING.,1,2017
3286,WE NEED MORE SOLUTIONS.,1,2017
3287,WE CAN'T KEEP DOING THE SAME THINGS THAT WE DID IN THE PAST.,1,2017
3288,MORE FLEXIBLE ZONING MIGHT HELP.,1,2017
3289,AUSTINS MAJOR PROBLEM IS VEHICULAR TRAFFIC.,6,2017
3290,DON'T SACRIFICE VEHICULAR LANES FOR BICYCLE LANES AND SIDEWALKS.,6,2017
3291,Austin's parks are too full to operate.,9,2017
3292,We need more parks.,9,2017
3293,We need more infrastructure (including rail) to fit all the new residents.,9,2017
3294,The city has outgrown itself.,9,2017
3295,We need to think ahead about how many more residents we can fit here.,9,2017
3296,AUSTINS VEHICLE LAW ENFORCEMENT HAS GOT TO BE THE WORST IN THE USA IF IT EXIST AT ALL.,5,2017
3297,Austin's water and wastewater rates are too high!,2,2017
3298,"Help keep Austin affordable by lowering these costs, since they now represent an amount equal or higher than my electric rates.",2,2017
3299,I've even asked others through the country and they have lower water and wastewater bills than I do (and I'm not a big user).,2,2017
3300,"AWESOME PLACE TO LIVE, BUT LET'S GET AHEAD OF THE TRAFFIC AND CONGESTION RATHER THAN PLAYING CATCH-UP!",8,2017
3301,THE SECRET IS OUT...,8,2017
3302,Be more helpful to working class,4,2017
3303,Better environmental education and services to support the zero waste goals,9,2017
3304,BETTER INFRASTRUCTURE,6,2017
3305,Better low income housing,2,2017
3306,BETTER MAINTAIN LANDSCAPE IN AND AROUND OLD CITY STREETS & ENFORCE YARD MAINTENANCE IN OLD AREAS OF THE CITY.,8,2017
3307,Better places to go with kids.,7,2017
3308,update parks/pools.,7,2017
3309,"WE need museums , other cultural experiences for families.",7,2017
3310,BETTER PROTECTION FROM RED LIGHT AND STOP SIGN VIOLATORS.,8,2017
3311,"HORRIBLE TRAFFIC CONGESTION BECAUSE TOO MANY PERMITS FOR CONDOS, APARTMENTS AND COMMERCIAL.",8,2017
3312,MOPAC AND I35 TRAFFIC GETTING WORSE.,8,2017
3313,better public transit.,5,2017
3314,Toll roads are not the answer,5,2017
3315,Better public transportation to and from the airport.,10,2017
3316,Better public transportation.,3,2016
3317,Better public transportation.,9,2017
3318,BETTER SIDEWALKS NEAR ELEMENTARY SCHOOLS.,6,2017
3319,BETTER STREET REPAIRS!,8,2017
3320,NOT THAT ITS THAT IMPORTANT.,8,2017
3321,BETTER TRAFFIC FLOW,8,2017
3322,better traffic plz,5,2017
3323,"Better transportation planning, especially highways.",1,2017
3324,Bicyclists in the street create dangerous situations for themselves and everyone around them.,2,2017
3325,Bike lane hazards for motorists.,10,2017
3326,Bike lanes are wasted money.,4,2017
3327,please upgrade the bus system,4,2017
3328,"BIKES ARE GREAT,BUT STOP PUTTING BIKE LANES ON EVERY STREET.",6,2017
3329,THEY ARE MINIMALLY UTILIZED AND DETRIMENTAL TO CAR TRAFFIC FLOW.,6,2017
3330,bring elon musk,7,2017
3331,Bring more affordable housing and improve major highways.,3,2017
3332,"Bring professional football , amusement park .",2,2017
3333,BUILD A LIGHT RAIL SYSTEM THAT TRAVERSES LAMAR BLVD.,4,2017
3334,SPLITS AT GUADALUPE AND THEN FEEDS INTO S. CONGRESS AND S. LAMAR.,4,2017
3335,HAVE A LOOP GO DOWNTOWN ON 5TH AND 6TH.,4,2017
3336,OUR PUBLIC TRANSIT STINKS!,4,2017
3337,"BUILD AN ELEVATED MONORAIL IN AND AROUND AUSTIN, PUT US ON THE MAP AS A FUTURISTIC CITY INSTEAD OF TRAFFIC PROBLEM CENTERAL",8,2017
3338,"Build roads, build and bridges across the Colorado, maintain streets.",8,2017
3339,"BUILD SIDEWALKS, FUND YOUR LIBRARIES AS CITY CENTERS, WORK ON CLEANLINESS, BE A FRIENDLIER CITY TO ALL.",6,2017
3340,BUILD TRAINS,1,2017
3341,"Build trust, and communicate with Austin residents.",6,2017
3342,Build upwards with vertical gardens,7,2017
3343,"Bulk collection, trash collection, recycling collection, etc.,",7,2017
3344,"could all be increased, e.g., bulk collection 4x a year, recycling 1-2 times a week, etc.",7,2017
3345,CANNOT AFFORD TO LIVE IN AUSTIN ANYMORE.,2,2017
3346,TAXES ARE TOO HIGH FOR HOMESTEAD PROPERTY.,2,2017
3347,HUSBAND HAS 2 JOBS.,2,2017
3348,WHAT ARE YOU DOING FOR HOMELESS?,2,2017
3349,Cedar St Bar is hindering the development of downtown neighborhood due to its complete dismissal of stadium grade sound pollution.,9,2017
3350,Central city neighborhoods are expected to engage with low-income housing or the planning/zoning process to a degree that is either not expected or circumvented by affluent neighborhoods to the north and west.,1,2017
3351,The cores of SF homes across the city should be treated equally in this regard.,1,2017
3352,CHALLENGE THE STATE AT EVERY TURN WHEN IT INFRINGES ON LOCAL GOVERNMENT RIGHTS.,2,2017
3353,STATE GOVERNMENT UNDER ABBOTT IS ABSURD SO MUCH FOR FREEDOM.,2,2017
3354,CHANGE POLICE POLICY ON SHOOT FIRST ASK QUESTIONS LATER.,1,2017
3355,HOLD THEM ACCOUNTABILITY.,1,2017
3356,CHANNEL DEVELOPMENT AWAY FROM DEPENDENCE ON EXISTING ROADS.,10,2017
3357,PERIMETER AREAS NEED TO BE BUILT THAT DON'T RELY ON COMMUTING TO DOWNTOWN.,10,2017
3358,"Charges for wastewater are too high and have no relation to actual water ""wasted"".",8,2017
3359,Check out our electricity bill in which they are charging for cleaning the streets and I have not seen a street cleaner in my neighborhood cleaning my street.,4,2017
3360,Only cleaning major streets!,4,2017
3361,CHECK WITH CITIZENS BEFORE SPENDING WE DO NOT NEED A MAYOR WHO IS MORE INTERESTED IN WHAT OTHER CITIES ARE BEING THAN WHAT IS NEEDED TO IMPROVE AUSTIN.,2,2017
3362,City council are real egotistical bastards destroying this great city...bring back Don Zimmerman and make him the mayor to clean up this shit hole.,6,2017
3363,"I have lived here from 600,000 population and now you want to import Mexico to take over city.",6,2017
3364,"STOP SANCTUARY CITY STATUS , IT IS ILLEGAL AND PROMOTES A CIVIL WAR.",6,2017
3365,City council is useless.,7,2017
3366,CITY COUNCIL SHOULD NOT BE ZONING COURT.,1,2017
3367,FIX AS NEEDED.,1,2017
3368,WE DO NOT NEED OUR COUNCIL HEARING ZONING CASE AFTER ZONING CASE.,1,2017
3369,City employees have always been extremely kind and professional.,9,2017
3370,"city is keeping up with growing population well, once MOPAC project is done time to work on I35, roads overall are great love hwy 130",8,2017
3371,"CITY NEEDS TO FIX SERIOUS DRAINAGE ISSUES, AND LET CITIZENS PROTECT THEIR HOMES WHILE THEY AWAIT A CURE.",5,2017
3372,"WATERSHED PROTECTION DEPARTMENT DIRECTOR, JOSE BEURRERO, HAS POOR JUDGEMENT.",5,2017
3373,City of Austin electric needs competition so the prices would be more fair to consumer,7,2017
3374,City of Austin employees consistently delight me in the quality of customer service and responsiveness.,7,2017
3375,"City of Austin is growing and should embrace the expansion needed to provide adequate transportation alternate route, mandatory work from home few times a week for City employees and offer incentive to other businesses who utilize the same schedule and build more safe playground areas for kids inside malls, shaded covered areas other than open space park!",5,2017
3376,"CITY PLANNING COMMISSION IS A JOKE, ONLY ""GREEN LIGHTING"" MAJOR DEVELOPMENTS INSTEAD OF LOCAL HOME GROWN BUSINESSES.",5,2017
3377,CITY TAXES ARE OUT OF SIGHT & INCREASING EVERY YEAR BY $400 ANNUALLY.,10,2017
3378,SENIOR CITIZENS LIVING ON SOCIAL SECURITY CANNOT MANAGE.,10,2017
3379,"WHEN A SPOUSE DIES, THE SS IS CUT IN HALF.",10,2017
3380,OUR SS BASED ON INCOME DURING 1950-1980 IS ABOUT 1/4 OF AVERAGE INCOME IN 2017.,10,2017
3381,THIS IS LOP-SIDED AND SHOULD BE CONSIDERED IN TAXATION.,10,2017
3382,Clean up downtown.,8,2017
3383,homeless shelter needs relocated,8,2017
3384,Clean up side street businesses.,4,2017
3385,N Lamar is an embarrassment.,4,2017
3386,Clean up the drugs and prostitution in the Oltorf/Riverside area.,3,2017
3387,"Especially Burton, Willow Creek, Burleson.",3,2017
3388,The activity is flagrant and gone unchecked for years.,3,2017
3389,CLEANING THE FREEWAYS AND LANDSCAPE!,6,2017
3390,LOOKS AWFUL!,6,2017
3391,CLEAR UP THE TRAFFIC JAMS!,10,2017
3392,NEED MORE FLOW FOR CARS - EASIER TO TRAVEL IN TRAFFIC.,10,2017
3393,LOWER TAXES!,10,2017
3394,THE RATE OF LIVING IN AUSTIN IS TOO HIGH!,10,2017
3395,LOWER PROPERTY TAXES!,10,2017
3396,"CLOSE ARCH DOWNTOWN, REVAMP AND EDIT ALL SOCIAL SERVICE PROVIDERS.",1,2017
3397,CODE ENFORCEMENTS FOR LARGE BUILDING SITES (CONSTRUCTION SITES),1,2017
3398,Code Next is not viable for established single family neighborhoods.,7,2017
3399,"It does not address water runoff, traffic or parking congestion.",7,2017
3400,It assumes everyone will use public transportation and not own a car.,7,2017
3401,Have you ever tried to go grocery shopping or take children to daycare using the bus system?,7,2017
3402,"CodeNExt does not allow for transition, no affordable housing",7,2017
3403,"CodeNext is a disaster, wrong-headed, detrimental to neighborhoods.",9,2017
3404,"There are other, better ways.",9,2017
3405,Please scrap CodeNext.,9,2017
3406,END AUSTIN AS A SANCTUARY CITY!,8,2017
3407,ENFORCE THE LAWS OF THIS CITY AND GET THE PANHANDLERS OFF OUR STREETS!,8,2017
3408,CODENEXT IS A SERIOUS PROBLEM.,9,2017
3409,MULTI-FAMILY HOMES ON STREETS THAT ARE ALREADY NARROW AND CROWDED IS A TERRIBLE IDEA.,9,2017
3410,"WE DON'T HAVE ENOUGH PARKING AS IT IS, AND I HAVE NO IDEA WHERE ALL THE EXTRA CARS/PEOPLE WILL GO.",9,2017
3411,"CodeNext is taking out half of parking, city must start developing a mass transit system",10,2017
3412,Codenext needs to not increase the density in the neighborhoods close to downtown.,10,2017
3413,Codenext feels like I am being rezoned with no discussion.,10,2017
3414,Commercial building permitting and site development reviews are entirely too wasteful and prolonged.,3,2017
3415,"An overhaul is needed, and permit expediters need to go!",3,2017
3416,I love Austin.,3,2017
3417,complete all constructions of bldgs.,3,2017
3418,",,apt, highways  and roads  before starting another.",3,2017
3419,Concentrate on what a city government needs to provide.,10,2017
3420,Concern for amount of homes being built and impact on traffic,1,2017
3421,"CONCERN REGARDING PUBLIC TRANSPORTATION WHICH WHEN BUS RATES CHANGE OR ARE ELIMINATED, LEAVES ADA PARATRANSIT CUSTOMERS WITHOUT AFFORDABLE TRANSPORTATION OR ALTERNATIVES",1,2017
3422,Concerned about homeless,7,2017
3423,Concerned about rising population of addicts at parks,9,2017
3424,CONCERNED REGARDING THE NUMBER OF HOMELESS PEOPLE.,3,2017
3425,PLUS NEED TO ADDRESS FOOD HOUSING AND MEDICAL SERVICES FOR HOMELESS PEOPLE.,3,2017
3426,"Concerning the traffic on Mopac...the speed limit should be enforced and drivers ticketed (as they are in other cities) for driving under the speed limit in the ""passing lane""/far left lane.",6,2017
3427,There is already a statute concerning not driving the speed limit.,6,2017
3428,"Also, start  enforcing no cell phone use on Mopac/City of Austin, as well.",6,2017
3429,"Monday through Friday I drive from Cedar Park to downtown and back home at night, and every day I see 1 out of every 3rd driver on their phone or texting.",6,2017
3430,They are all driving under the speed limit and causing congestion at the very least.,6,2017
3431,"If  tickets were issued for the above, you could use the money to build the roads, instead of taxing citizens.",6,2017
3432,consider a monorail system to help traffic congestion,7,2017
3433,CONSIDER A RAIL LINE WITHIN THE NEW 183 CORRIDOR INTO DOWNTOWN TO ENCOURAGE VISITORS TO USE PUBLIC TRANSPORTATION IN TO THE CITY RATHER THAN RENT AUTOS.,9,2017
3434,CONNECT WITH CURRENT RAIL LINE.,9,2017
3435,Consider Home taxes,1,2017
3436,CONSISTENCY IN THE PERMITTING PROCESS FOR RESIDENTIAL BUILDING.,9,2017
3437,THE ONLY THING CONSISTENT IS THE INCONSISTENCY IN THE REVIEW PROCESS.,9,2017
3438,CONSTANT GRAFFITI IN PUBLIC PLACES IS OUT OF CONTROL LAWS ON THIS SHOULD BE ENFORCED MORE STRICT AND WITH HARSHER PENALTIES.,5,2017
3439,"I WOULD SUPPORT JAIL TIME FOR VANDALS, LAMAR TRAIL BRIDGE AND FIRST ST BRIDGE ARE PRIME EXAMPLES",5,2017
3440,Continue diversity and friendliness,4,2017
3441,Continue doing what is best for the city as a whole including efforts to increase density with improvements to transportation.,3,2017
3442,I like they way downtown and key business/community corridors are developing.,3,2017
3443,We must continue to look forward.,3,2017
3444,"While respecting the past, we can not tie the future of Austin to maintaining everything as if we can continue to live in the past.",3,2017
3445,CONTINUE MOVING FORWARD WITH URBAN BIKE ROUTES.,6,2017
3446,YOU ARE GETTING THERE SLOWLY BUT STILL HAVE A WAYS TO GO.,6,2017
3447,Continue resisting the efforts of the Legislature to control Austin.,3,2017
3448,CONTINUE STANDING UP FOR THE STATE.,9,2017
3449,CONTINUE TO BE A SANCTUARY PLACE.,9,2017
3450,"ALL IMMIGRANTS OR MAJORITY THAT COME HERE ARE LOOKING FOR A SAFE PLACE TO WORK, OWN PROPERTY, PAY TAXES.",9,2017
3451,Continue to be accessible and open with communication to the Austin citizens.,7,2017
3452,"Continue to promote Austin as an open, welcoming community to all ethnicities, sexual orientations, and origins.",7,2017
3453,Help to establish safer and less traffic-y ways to get around Austin on all forms of transportation.,7,2017
3454,"And try to increase housing affordability, especially for seniors and low-income families.",7,2017
3455,CONTINUE TO BE STRONG AND KEEP UP THE GOOD WORK.,6,2017
3456,I VERY MUCH ADMIRE OUR MAYOR.,6,2017
3457,"continue to build the tourism, hotel, convention business downtown",6,2017
3458,Continue to encourage/incentivize use of public transit,5,2017
3459,Continue to ensure an open dialog between city officials and residents.,7,2017
3460,"Continue to fight for the city's ability to enact its own ordinances, and don't allow governor Abbott's power grab to supersede local authority take away our agency as a community.",3,2017
3461,Cut waste less spending,2,2017
3462,CONTINUE TO MAKE AUSTIN A MORE ENVIRONMENTALLY FRIENDLY CITY.,2,2017
3463,"INCREASE RENEWABLE ENERGY USE, PROMOTE PUBLIC TRANSIT, BIKING, WALKING ETC.",2,2017
3464,"CONTINUE TO RAPIDLY AND AGGRESSIVELY ADDRESS SOLUTIONS FOR RAPID GROWTH, ESPECIALLY TRAFFIC AND PUBLIC SAFETY/HEALTH.",10,2017
3465,CONTINUE TO RESIST TRUMP AND TEXAS STATE CONSERVATIVES TRYING TO CONTROL OUR CITY.,7,2017
3466,Continue to solve the problems with the homeless population.,10,2017
3467,Continue to support diversity,9,2017
3468,CONTINUE TO SUPPORT THE EXCELLENT LIBRARIES.,4,2017
