,user_id,domain,comment_id,sent_id,sents_in_comment,span_start,span_end,text,num_tokens,aq,stance_dict,kp_quality,sentence_embeddings,id,selected_stance,stance_conf
909,db0a12,austin_demo,868,0,1,0,50,"NO MORE GROWTH, FOR PETE SAKE, TRAFFIC IS HORRIBLE",9,0.2053327113389969,"{'pos': 0.0009732915204949677, 'neg': 0.993765115737915, 'sug': 0.0019896894227713346, 'neut': 0.0032719115260988474}",0.01999455690383911,,648ad137ffba66f356f16e29,neg,0.993765115737915
910,db0a12,austin_demo,1251,0,6,0,157,"SUBSTANTIALLY reduce the TOTAL property tax burden on residential property and specifically homeowners from ALL taxing entities, not just the City of Austin.",23,0.790915310382843,"{'pos': 0.0019510268466547132, 'neg': 0.002354634692892432, 'sug': 0.9860349893569946, 'neut': 0.009659364819526672}",0.0,,648ad137ffba66f356f16e2a,sug,0.9860349893569946
911,db0a12,austin_demo,11,0,1,0,50,60% of streets in Govalle Johnston NEED SEDEWALKS.,8,0.146272674202919,"{'pos': 0.004376741126179695, 'neg': 0.2829294502735138, 'sug': 0.6384950280189514, 'neut': 0.07419876009225845}",0.6688633561134338,,648ad137ffba66f356f16e2b,sug,0.6384950280189514
912,db0a12,austin_demo,1251,1,6,158,262,"We would love for my wife to stop working to care for our child, but we do not think we could afford it.",23,0.5443540215492249,"{'pos': 0.0034203259274363518, 'neg': 0.4923980236053467, 'sug': 0.044536951929330826, 'neut': 0.4596446454524994}",0.0,,648ad137ffba66f356f16e2c,neg,0.4923980236053467
913,db0a12,austin_demo,165,0,1,0,50,Bullet train between Austin and Houston/Dallas/SA.,8,0.5629168152809143,"{'pos': 0.0036023620050400496, 'neg': 0.007807200308889151, 'sug': 0.9373002052307129, 'neut': 0.05129026621580124}",0.5836111307144165,,648ad137ffba66f356f16e2d,sug,0.9373002052307129
914,db0a12,austin_demo,1251,2,6,263,431,The City of Austin needs to STOP doing so much extra stuff and just focus on the basics and streamlining processes to accomplish more with the same number of employees.,30,0.742826521396637,"{'pos': 0.0019011335680261254, 'neg': 0.02023288607597351, 'sug': 0.9722281098365784, 'neut': 0.005637886933982372}",0.0,,648ad137ffba66f356f16e2e,sug,0.9722281098365784
915,db0a12,austin_demo,1042,0,1,0,50,POLICE COULD TAKE WOMEN WITH BABIES MORE SERIOUSLY,8,0.3154886066913605,"{'pos': 0.002718034666031599, 'neg': 0.0053887139074504375, 'sug': 0.9855262041091919, 'neut': 0.006367071997374296}",0.9865484833717346,,648ad137ffba66f356f16e30,sug,0.9855262041091919
916,db0a12,austin_demo,1251,3,6,432,654,"Also, the City leadership needs to work with the other taxing entities to REDUCE the per household property tax burden by changing how the State of Texas funds public education by taking money from property rich districts.",37,0.6035431623458862,"{'pos': 0.00214477744884789, 'neg': 0.0033832420594990253, 'sug': 0.9889819025993347, 'neut': 0.00549002829939127}",0.0,,648ad137ffba66f356f16e31,sug,0.9889819025993347
917,db0a12,austin_demo,109,0,1,0,51,Be more proactive in city planning and development.,8,0.467046320438385,"{'pos': 0.0019306441536173224, 'neg': 0.0032400544732809067, 'sug': 0.9907482266426086, 'neut': 0.00408096332103014}",0.9943400025367737,,648ad137ffba66f356f16e32,sug,0.9907482266426086
918,db0a12,austin_demo,1251,4,6,655,715,A statewide sales tax for education would be much more fair.,11,0.6308357119560242,"{'pos': 0.0019014400895684958, 'neg': 0.0034023388288915157, 'sug': 0.9892088770866394, 'neut': 0.00548744760453701}",0.9944378137588501,,648ad137ffba66f356f16e33,sug,0.9892088770866394
919,db0a12,austin_demo,833,0,1,0,51,NEED BETTER CLEAN UP OF STORM CULVERTS AND TUNNELS.,9,0.28265753388404846,"{'pos': 0.002832162193953991, 'neg': 0.07363264262676239, 'sug': 0.9105347394943237, 'neut': 0.013000504113733768}",0.9873659610748291,,648ad137ffba66f356f16e34,sug,0.9105347394943237
920,db0a12,austin_demo,1251,5,6,716,816,STOP doing so many affordability programs that just increase property tax and/or utility tax burden.,16,0.6248818039894104,"{'pos': 0.0017607281915843487, 'neg': 0.9340929985046387, 'sug': 0.05390253663063049, 'neut': 0.010243771597743034}",0.0,,648ad137ffba66f356f16e35,neg,0.9340929985046387
921,db0a12,austin_demo,1335,0,1,0,51,The main highways (Mopac and IH35) need more lanes.,9,0.5338171124458313,"{'pos': 0.001678415690548718, 'neg': 0.005530197639018297, 'sug': 0.9860213398933411, 'neut': 0.0067701260559260845}",0.10195564478635788,,648ad137ffba66f356f16e36,sug,0.9860213398933411
922,db0a12,austin_demo,1223,0,8,0,54,stop shooting unarmed black people and harassing them.,8,0.3122539818286896,"{'pos': 0.002069261157885194, 'neg': 0.9779305458068848, 'sug': 0.013393540866672993, 'neut': 0.006606630049645901}",0.04532663896679878,,648ad137ffba66f356f16e38,neg,0.9779305458068848
923,db0a12,austin_demo,1223,1,8,55,120,There is no need to use deadly force on someone who is not armed.,14,0.79979008436203,"{'pos': 0.0036970057990401983, 'neg': 0.5725297927856445, 'sug': 0.39865371584892273, 'neut': 0.02511952631175518}",0.0,,648ad137ffba66f356f16e39,neg,0.5725297927856445
924,db0a12,austin_demo,1223,2,8,121,188,Stop harassing young black men that walk in their own neighborhood.,11,0.4779404401779175,"{'pos': 0.004953313618898392, 'neg': 0.23423528671264648, 'sug': 0.7384548783302307, 'neut': 0.022356567904353142}",0.9911537766456604,,648ad137ffba66f356f16e3a,sug,0.7384548783302307
925,db0a12,austin_demo,50,0,1,0,51,"Affordable housing, traffic, cleaner streets/roads.",6,0.4876364469528198,"{'pos': 0.012066397815942764, 'neg': 0.012590969912707806, 'sug': 0.27010855078697205, 'neut': 0.7052340507507324}",0.019289610907435417,,648ad137ffba66f356f16e3b,neut,0.7052340507507324
926,db0a12,austin_demo,1223,3,8,189,231,Better training and sensitivity is needed.,6,0.39000678062438965,"{'pos': 0.0021836392115801573, 'neg': 0.04930674284696579, 'sug': 0.939283549785614, 'neut': 0.009226040914654732}",0.9929637908935547,,648ad137ffba66f356f16e3c,sug,0.939283549785614
927,db0a12,austin_demo,1214,0,1,0,51,STOP OVER DEVELOPMENT AND WASTING TAX PAYERS MONEY.,8,0.5345253944396973,"{'pos': 0.0050935219042003155, 'neg': 0.455127477645874, 'sug': 0.4995938241481781, 'neut': 0.040185220539569855}",0.18190594017505646,,648ad137ffba66f356f16e3d,sug,0.4995938241481781
928,db0a12,austin_demo,1223,4,8,232,271,"Need better traffic flow, metro system.",6,0.25340840220451355,"{'pos': 0.0017050903989002109, 'neg': 0.007225448731333017, 'sug': 0.9865272641181946, 'neut': 0.004542146809399128}",0.020724711939692497,,648ad137ffba66f356f16e3f,sug,0.9865272641181946
929,db0a12,austin_demo,764,0,1,0,51,MoPac express lanes are money-grab and stupid idea.,9,0.4734707474708557,"{'pos': 0.0009248259011656046, 'neg': 0.9934219717979431, 'sug': 0.001434109639376402, 'neut': 0.004219165071845055}",0.18026846647262573,,648ad137ffba66f356f16e40,neg,0.9934219717979431
930,db0a12,austin_demo,1223,5,8,272,603,The reason to live in Austin and the reason people come to visit is the uniqueness and funkiness and different and weirdness of the downtown Congress area and you are allowing it to be driven away with these unaffordable high rises and ugly commercial buildings that have displaced the cool shops and restaurants on South Congress.,56,0.7771063446998596,"{'pos': 0.004467485472559929, 'neg': 0.9619205594062805, 'sug': 0.00821571797132492, 'neut': 0.025396233424544334}",0.0,,648ad137ffba66f356f16e41,neg,0.9619205594062805
931,db0a12,austin_demo,1445,0,1,0,51,Traffic and high utility bills are a problem for me,10,0.25032156705856323,"{'pos': 0.0007702228613197803, 'neg': 0.9953485131263733, 'sug': 0.0014485686551779509, 'neut': 0.0024326040875166655}",0.018547674641013145,,648ad137ffba66f356f16e42,neg,0.9953485131263733
932,db0a12,austin_demo,1223,6,8,605,767,You replaced the food trailer park for the ugliest condos and you are now replacing more cool shops and restaurants with some more mixed use commercial buildings.,27,0.4997783601284027,"{'pos': 0.0023688245564699173, 'neg': 0.7633668184280396, 'sug': 0.0049111321568489075, 'neut': 0.22935323417186737}",0.0,,648ad137ffba66f356f16e43,neg,0.7633668184280396
933,db0a12,austin_demo,1223,7,8,768,822,Pretty soon Congress will no longer be cool and weird.,10,0.1760834902524948,"{'pos': 0.003001888282597065, 'neg': 0.31864625215530396, 'sug': 0.006378370802849531, 'neut': 0.671973466873169}",0.03355637192726135,,648ad137ffba66f356f16e44,neut,0.671973466873169
934,db0a12,austin_demo,2,0,8,0,69,Maintenance of city facilities needs to be equitable across the city.,11,0.5605908036231995,"{'pos': 0.002154915826395154, 'neg': 0.0032375354785472155, 'sug': 0.989443302154541, 'neut': 0.005164250265806913}",0.9962331652641296,,648ad137ffba66f356f16e45,sug,0.989443302154541
935,db0a12,austin_demo,617,0,1,0,51,"IMPROVE TRAFFIC, ADDRESS MONOPOLY OF CITY UTILITIES",7,0.45623281598091125,"{'pos': 0.003243742510676384, 'neg': 0.03267006576061249, 'sug': 0.9390360116958618, 'neut': 0.025050196796655655}",0.01563127338886261,,648ad137ffba66f356f16e46,sug,0.9390360116958618
936,db0a12,austin_demo,2,1,8,70,161,"We need to think long-term; Austin can't sustain it's current level of ""chic"" indefinitely.",15,0.4705158472061157,"{'pos': 0.0016874076100066304, 'neg': 0.004604147747159004, 'sug': 0.9870381355285645, 'neut': 0.0066702826879918575}",0.0,,648ad137ffba66f356f16e47,sug,0.9870381355285645
937,db0a12,austin_demo,2,2,8,162,285,What are we going to do when the cool beautiful people move to a community with more shiny dime-store objects to lure them?,24,0.244317427277565,"{'pos': 0.0011567181209102273, 'neg': 0.9793669581413269, 'sug': 0.0033065048046410084, 'neut': 0.016169767826795578}",0.0,,648ad137ffba66f356f16e48,neg,0.9793669581413269
938,db0a12,austin_demo,2,3,8,286,395,Long after the current boom goes bust (and it always does) the rest of us real Austinites will still be here.,21,0.5669859051704407,"{'pos': 0.025782907381653786, 'neg': 0.008971170522272587, 'sug': 0.00387186580337584, 'neut': 0.9613741040229797}",0.0,,648ad137ffba66f356f16e49,neut,0.9613741040229797
939,db0a12,austin_demo,2,4,8,396,578,It really is time to stop sacrificing the quality of life on the east side of town (or any of the less-privileged parts of town) for the wants of those living in the wealthier areas.,36,0.8828604817390442,"{'pos': 0.0025313356891274452, 'neg': 0.9289127588272095, 'sug': 0.05841060355305672, 'neut': 0.010145370848476887}",0.0,,648ad137ffba66f356f16e4a,neg,0.9289127588272095
940,db0a12,austin_demo,2,5,8,579,647,The differences from one neighborhood to the next are quite visible.,11,0.3043769299983978,"{'pos': 0.0009593329741619527, 'neg': 0.9957066178321838, 'sug': 0.0012148867826908827, 'neut': 0.0021192810963839293}",0.2172853797674179,,648ad137ffba66f356f16e4b,neg,0.9957066178321838
941,db0a12,austin_demo,2,6,8,648,754,"Public transportation needs to be a primary issue, whether the numerous single-car drivers like it or not.",18,0.4135708212852478,"{'pos': 0.001895778812468052, 'neg': 0.0036808205768465996, 'sug': 0.988707423210144, 'neut': 0.005715989042073488}",0.0,,648ad137ffba66f356f16e4c,sug,0.988707423210144
942,db0a12,austin_demo,2,7,8,755,834,"In short, we need to find our way back to being both more humane and pragmatic.",16,0.49136054515838623,"{'pos': 0.0019733307417482138, 'neg': 0.0025051399134099483, 'sug': 0.9900568127632141, 'neut': 0.005464617628604174}",0.0,,648ad137ffba66f356f16e4d,sug,0.9900568127632141
943,db0a12,austin_demo,1265,0,9,0,124,"Take better care of the poor addicted disenfranchised people - help get them in programs and off the drugs, off the streets.",21,0.7213138341903687,"{'pos': 0.0020403678063303232, 'neg': 0.008157282136380672, 'sug': 0.9846652150154114, 'neut': 0.005137189757078886}",0.0,,648ad137ffba66f356f16e4e,sug,0.9846652150154114
944,db0a12,austin_demo,1265,1,9,125,330,"Austin does so many things right, but there are many many vagrants / beggars / homeless /dealer/addicts - mini squatter settlements under 35 and always around the town lake trail - do they need drug rehab?",33,0.4055340588092804,"{'pos': 0.006396580021828413, 'neg': 0.023402828723192215, 'sug': 0.006222588941454887, 'neut': 0.9639779925346375}",0.0,,648ad137ffba66f356f16e4f,neut,0.9639779925346375
945,db0a12,austin_demo,389,0,1,0,51,fix the traffic problem on highways and residential,8,0.2576768398284912,"{'pos': 0.004806783515959978, 'neg': 0.36934012174606323, 'sug': 0.6012357473373413, 'neut': 0.024617303162813187}",0.10906492173671722,,648ad137ffba66f356f16e50,sug,0.6012357473373413
946,db0a12,austin_demo,1265,2,9,331,344,job training?,2,0.2676553428173065,"{'pos': 0.005264392122626305, 'neg': 0.007793678902089596, 'sug': 0.02721804566681385, 'neut': 0.9597238302230835}",0.033193912357091904,,648ad137ffba66f356f16e51,neut,0.9597238302230835
947,db0a12,austin_demo,1265,4,9,354,371,all of the above?,4,0.26797670125961304,"{'pos': 0.012817462906241417, 'neg': 0.020532937720417976, 'sug': 0.019724510610103607, 'neut': 0.9469251036643982}",0.018707269802689552,,648ad137ffba66f356f16e53,neut,0.9469251036643982
948,db0a12,austin_demo,816,0,1,0,51,MOVE HOMELESS SHELTER OUT OF DOWNTOWN AND EXPAND IT,9,0.3382968008518219,"{'pos': 0.0023426557891070843, 'neg': 0.003382412251085043, 'sug': 0.9853727221488953, 'neut': 0.008902210742235184}",0.028009075671434402,,648ad137ffba66f356f16e52,sug,0.9853727221488953
949,db0a12,austin_demo,1265,5,9,372,579,It especially makes me very sad to see the people outside the arch - predominantly African American - Austin can not consider itself a progressive inclusive city while Black folks are living in such poverty.,33,0.6311730742454529,"{'pos': 0.0010535073233768344, 'neg': 0.9927513599395752, 'sug': 0.0016103927046060562, 'neut': 0.004584730137139559}",0.0,,648ad137ffba66f356f16e54,neg,0.9927513599395752
950,db0a12,austin_demo,17,0,1,0,51,A solution to the horrendous traffic problem on 35.,9,0.45257407426834106,"{'pos': 0.004234072286635637, 'neg': 0.048952728509902954, 'sug': 0.17623302340507507, 'neut': 0.7705801725387573}",0.9939905405044556,,648ad137ffba66f356f16e55,neut,0.7705801725387573
951,db0a12,austin_demo,1265,6,9,580,694,Whatever social services people need to get back on their feet and become part of this vibrant economy -- do it!!!,20,0.5732213854789734,"{'pos': 0.008671107701957226, 'neg': 0.003890253370627761, 'sug': 0.9122209548950195, 'neut': 0.07521762698888779}",0.0,,648ad137ffba66f356f16e56,sug,0.9122209548950195
952,db0a12,austin_demo,1014,0,1,0,52,PLEASE PASS A LAW TO PROTECT RENTERS FROM INCREASES.,9,0.442321240901947,"{'pos': 0.001896415720693767, 'neg': 0.0046918438747525215, 'sug': 0.9878438711166382, 'neut': 0.005567862186580896}",0.993358314037323,,648ad137ffba66f356f16e57,sug,0.9878438711166382
953,db0a12,austin_demo,1265,7,9,696,818,AND PLEASE GIVE US SAFE BIKE LANES THAT ARE PHYSICALLY SEPARATED FROM CARS - THIS COULD BE A TOTAL BIKING CITY YEAR ROUND.,22,0.49298906326293945,"{'pos': 0.0027612666599452496, 'neg': 0.0024512975942343473, 'sug': 0.9860244393348694, 'neut': 0.00876308511942625}",0.0,,648ad137ffba66f356f16e58,sug,0.9860244393348694
954,db0a12,austin_demo,331,0,1,0,52,ENFORCEMENT OF TRAFFIC LAWS TO KEEP TRAFFIC FLOWING.,8,0.40892693400382996,"{'pos': 0.005602685734629631, 'neg': 0.0020813625305891037, 'sug': 0.92909175157547, 'neut': 0.06322412192821503}",0.26984527707099915,,648ad137ffba66f356f16e59,sug,0.92909175157547
955,db0a12,austin_demo,1265,8,9,819,829,thank you.,2,0.31304994225502014,"{'pos': 0.9934554696083069, 'neg': 0.0012986140791326761, 'sug': 0.0010068798437714577, 'neut': 0.00423898920416832}",0.014307950623333454,,648ad137ffba66f356f16e5a,pos,0.9934554696083069
956,db0a12,austin_demo,726,0,1,0,52,major drug use at the arch and other downtown areas.,10,0.3500821590423584,"{'pos': 0.0009140365873463452, 'neg': 0.9951980710029602, 'sug': 0.0015933779068291187, 'neut': 0.002294544829055667}",0.02372445911169052,,648ad137ffba66f356f16e5b,neg,0.9951980710029602
957,db0a12,austin_demo,792,0,6,0,130,More needs to be done to ensure the part of the city East of I 35 receives the same services as the part of the city West of I 35.,30,0.7595109939575195,"{'pos': 0.0020617616828531027, 'neg': 0.030338527634739876, 'sug': 0.9599624872207642, 'neut': 0.007637227885425091}",0.0,,648ad137ffba66f356f16e5c,sug,0.9599624872207642
958,db0a12,austin_demo,730,0,1,0,52,More enforcement of residential watering violations.,6,0.3045603036880493,"{'pos': 0.0018674522871151567, 'neg': 0.003506534267216921, 'sug': 0.988116979598999, 'neut': 0.006509033031761646}",0.9964091181755066,,648ad137ffba66f356f16e5d,sug,0.988116979598999
959,db0a12,austin_demo,341,0,1,0,52,Everyday I feel the Austin road traffic is hopeless.,9,0.19163720309734344,"{'pos': 0.0009099584422074258, 'neg': 0.9942983984947205, 'sug': 0.0014866809360682964, 'neut': 0.003304937621578574}",0.9910582304000854,,648ad137ffba66f356f16e5e,neg,0.9942983984947205
960,db0a12,austin_demo,792,1,6,131,262,The medians and sidewalks in East Austin remain overgrown and the parks do not get attention with regard to cleanliness and safety.,22,0.6620898246765137,"{'pos': 0.0007608311716467142, 'neg': 0.9961857199668884, 'sug': 0.0013552821474149823, 'neut': 0.001698216306976974}",0.0,,648ad137ffba66f356f16e5f,neg,0.9961857199668884
961,db0a12,austin_demo,965,0,1,0,52,PLEASE FOSTER POPULATION CONTROL FOR QUALITY OF LIFE,8,0.5208613276481628,"{'pos': 0.0025796869304031134, 'neg': 0.0030877888202667236, 'sug': 0.9885359406471252, 'neut': 0.005796573590487242}",0.9911667704582214,,648ad137ffba66f356f16e60,sug,0.9885359406471252
962,db0a12,austin_demo,792,2,6,263,406,"You can drive around West Austin and see no streets, medians, or sidewalks that are overgrown with weeds like the ones on streets east of I 35.",27,0.5812391638755798,"{'pos': 0.0007414547144435346, 'neg': 0.9914236664772034, 'sug': 0.0017420223448425531, 'neut': 0.006092920899391174}",0.0,,648ad137ffba66f356f16e61,neg,0.9914236664772034
963,db0a12,austin_demo,803,0,2,0,39,MORE ROADS FIX THE ONES WE HAVE BETTER.,8,0.30850180983543396,"{'pos': 0.0022572309244424105, 'neg': 0.0034869045484811068, 'sug': 0.9860422015190125, 'neut': 0.008213724009692669}",0.018440866842865944,,648ad137ffba66f356f16e62,sug,0.9860422015190125
964,db0a12,austin_demo,792,3,6,407,485,City services in east of I 35 are not as plentiful as they are in West Austin.,17,0.6562641263008118,"{'pos': 0.0005926957237534225, 'neg': 0.9958958625793457, 'sug': 0.0013501056237146258, 'neut': 0.0021612776909023523}",0.0,,648ad137ffba66f356f16e64,neg,0.9958958625793457
965,db0a12,austin_demo,803,1,2,40,53,TRAFFIC FLOW.,2,0.2625676989555359,"{'pos': 0.008490724489092827, 'neg': 0.012827827595174313, 'sug': 0.010191702283918858, 'neut': 0.9684896469116211}",0.016861220821738243,,648ad137ffba66f356f16e65,neut,0.9684896469116211
966,db0a12,austin_demo,792,4,6,486,622,"I am not talking about the section of Austin that is now being called ""East Austin"" that is being gentrified or the Mueller development.",24,0.4675089716911316,"{'pos': 0.00539517542347312, 'neg': 0.023548927158117294, 'sug': 0.1566067487001419, 'neut': 0.8144491314888}",0.0,,648ad137ffba66f356f16e66,neut,0.8144491314888
967,db0a12,austin_demo,300,0,1,0,53,Don't let Austin become Houston with overdevelopment.,7,0.6250386238098145,"{'pos': 0.0028013179544359446, 'neg': 0.07509006559848785, 'sug': 0.8941983580589294, 'neut': 0.02791021391749382}",0.9939767122268677,,648ad137ffba66f356f16e67,sug,0.8941983580589294
968,db0a12,austin_demo,792,5,6,623,869,"I am talking about the rest of the city east of I 35, I hope that now that we have single member districts on the City Council, those that represent sections of Austin east of I 35 can focus some of the city's attention on this ongoing disparity.",48,0.5507597327232361,"{'pos': 0.0016512259608134627, 'neg': 0.004439909942448139, 'sug': 0.9855304956436157, 'neut': 0.008378342725336552}",0.0,,648ad137ffba66f356f16e68,sug,0.9855304956436157
969,db0a12,austin_demo,1082,0,1,0,53,Questionable employee politics in COA Public Works HR,8,0.22355930507183075,"{'pos': 0.0012753509217873216, 'neg': 0.9921173453330994, 'sug': 0.0029949620366096497, 'neut': 0.0036122554447501898}",0.9944638609886169,,648ad137ffba66f356f16e69,neg,0.9921173453330994
970,db0a12,austin_demo,1293,0,11,0,53,The amount charged for electrical and water services.,8,0.31738173961639404,"{'pos': 0.0035996895749121904, 'neg': 0.008021589368581772, 'sug': 0.012141001410782337, 'neut': 0.9762377738952637}",0.016268668696284294,,648ad137ffba66f356f16e6b,neut,0.9762377738952637
971,db0a12,austin_demo,1293,1,11,54,121,My water bill went from $25.00 in June 2015 to $78.00 in June 2015.,16,0.49546968936920166,"{'pos': 0.0006230739527381957, 'neg': 0.9937432408332825, 'sug': 0.001170820090919733, 'neut': 0.004462925251573324}",0.0,,648ad137ffba66f356f16e6c,neg,0.9937432408332825
972,db0a12,austin_demo,1190,0,1,0,53,Stick to city business and skip the national politics,9,0.43378356099128723,"{'pos': 0.004147623665630817, 'neg': 0.005757609382271767, 'sug': 0.8909111022949219, 'neut': 0.09918364882469177}",0.3917907178401947,,648ad137ffba66f356f16e6d,sug,0.8909111022949219
973,db0a12,austin_demo,1293,2,11,122,181,"The months in 2015 June, July, and August were just as bad.",12,0.33108270168304443,"{'pos': 0.005996397230774164, 'neg': 0.5449183583259583, 'sug': 0.006385247688740492, 'neut': 0.44269999861717224}",0.014506565406918526,,648ad137ffba66f356f16e6e,neg,0.5449183583259583
974,db0a12,austin_demo,440,0,1,0,53,FREEK PIKC BEGINNING AT AGE 3 FOR LOW INCOME FAMILIES,10,0.375311940908432,"{'pos': 0.0064280275255441666, 'neg': 0.010801843367516994, 'sug': 0.5350272059440613, 'neut': 0.44774290919303894}",0.023542732000350952,,648ad137ffba66f356f16e6f,sug,0.5350272059440613
975,db0a12,austin_demo,1293,3,11,182,273,When I called the person I spoke to just told me I had used more water during those months.,19,0.2092265486717224,"{'pos': 0.0008956169476732612, 'neg': 0.99518883228302, 'sug': 0.0011027817381545901, 'neut': 0.0028127641417086124}",0.0,,648ad137ffba66f356f16e70,neg,0.99518883228302
976,db0a12,austin_demo,898,0,2,0,17,OVERALL GOOD JOB.,3,0.327807754278183,"{'pos': 0.9950706958770752, 'neg': 0.0011028442531824112, 'sug': 0.0008964753360487521, 'neut': 0.002930049318820238}",0.9818877577781677,,648ad137ffba66f356f16e71,pos,0.9950706958770752
977,db0a12,austin_demo,1293,4,11,274,299,That is all he would say.,6,0.19669295847415924,"{'pos': 0.0030514264944940805, 'neg': 0.016656147316098213, 'sug': 0.0036705241072922945, 'neut': 0.9766218066215515}",0.014837357215583324,,648ad137ffba66f356f16e72,neut,0.9766218066215515
978,db0a12,austin_demo,898,1,2,18,53,IT'S JUST GETTING TOO CROWDED HERE.,6,0.39675870537757874,"{'pos': 0.0011458145454525948, 'neg': 0.9927734732627869, 'sug': 0.0017789349658414721, 'neut': 0.004301827400922775}",0.9899020195007324,,648ad137ffba66f356f16e73,neg,0.9927734732627869
979,db0a12,austin_demo,1293,5,11,300,398,"I told him nothing changed, number of people living here, no swimming poll, no grass watering etc.",17,0.16671612858772278,"{'pos': 0.0006992000271566212, 'neg': 0.9663423299789429, 'sug': 0.0016456127632409334, 'neut': 0.031312789767980576}",0.0,,648ad137ffba66f356f16e74,neg,0.9663423299789429
980,db0a12,austin_demo,1293,6,11,399,419,He just blew me off.,5,0.24429751932621002,"{'pos': 0.0012040432775393128, 'neg': 0.9935044050216675, 'sug': 0.0020331847481429577, 'neut': 0.0032584406435489655}",0.015436939895153046,,648ad137ffba66f356f16e75,neg,0.9935044050216675
981,db0a12,austin_demo,919,0,1,0,53,PLEAS WORK WITH APD TO TRAIN ORFFICERS TO DE-ESCALTER,10,0.24804510176181793,"{'pos': 0.0023273539263755083, 'neg': 0.0037809840869158506, 'sug': 0.9880130290985107, 'neut': 0.005878669675439596}",0.11396600306034088,,648ad137ffba66f356f16e76,sug,0.9880130290985107
982,db0a12,austin_demo,1293,7,11,420,497,I got behind in my electric bill and they agreed to put me on a payment plan.,17,0.5374277234077454,"{'pos': 0.009121816605329514, 'neg': 0.003611510619521141, 'sug': 0.004459195304661989, 'neut': 0.9828073978424072}",0.0,,648ad137ffba66f356f16e77,neut,0.9828073978424072
983,db0a12,austin_demo,1439,0,1,0,52,"Traffic all facets-planning, congestion, enforcement",6,0.4666827917098999,"{'pos': 0.004728443454951048, 'neg': 0.008021904155611992, 'sug': 0.016503700986504555, 'neut': 0.970745861530304}",0.016508331522345543,,648ad137ffba66f356f16e78,neut,0.970745861530304
984,db0a12,austin_demo,1293,8,11,498,687,I was 1 day late in getting my payment in and they pulled me off the plan and told me that I had to come up with $580.00 dollars then they would add $78 dollars to my regular electric bill.,41,0.5803471207618713,"{'pos': 0.000611024210229516, 'neg': 0.996066153049469, 'sug': 0.0013793734833598137, 'neut': 0.0019434138666838408}",0.0,,648ad137ffba66f356f16e79,neg,0.996066153049469
985,db0a12,austin_demo,1293,9,11,688,814,"I am 72 years of age and on a fixed income, I certainly had to do without a lot of things the get the money that was required.",28,0.4548211693763733,"{'pos': 0.002594241639599204, 'neg': 0.02054455690085888, 'sug': 0.004586721770465374, 'neut': 0.9722744822502136}",0.0,,648ad137ffba66f356f16e7b,neut,0.9722744822502136
986,db0a12,austin_demo,1293,10,11,815,862,Being 1 day late is no reason to punish anyone.,10,0.4650787115097046,"{'pos': 0.0007644405704922974, 'neg': 0.9934009909629822, 'sug': 0.0032142603304237127, 'neut': 0.002620389685034752}",0.020696861669421196,,648ad137ffba66f356f16e7c,neg,0.9934009909629822
987,db0a12,austin_demo,58,0,1,0,53,ALWAYS MORE SERVICES FOR THE LOWER INCOME POPULATION.,8,0.48465463519096375,"{'pos': 0.005207776091992855, 'neg': 0.04328380525112152, 'sug': 0.1540652960538864, 'neut': 0.7974430918693542}",0.9824953079223633,,648ad137ffba66f356f16e7d,neut,0.7974430918693542
