,user_id,domain,comment_id,sent_id,sents_in_comment,span_start,span_end,text,num_tokens,aq,stance_dict,kp_quality,sentence_embeddings,id,selected_stance,stance_conf
0,db0a12,austin_demo,751,0,1,0,153,"Make ridesharing more accessible, fix the highways by making turnarounds and better mergers/ramps, and stop the gentrification that is killing this city.",23,0.572187602519989,"{'pos': 0.002004630398005247, 'neg': 0.016649603843688965, 'sug': 0.9730961918830872, 'neut': 0.008249593898653984}",0.0,,648ad137ffba66f356f16a49,sug,0.9730961918830872
1,db0a12,austin_demo,1139,0,2,0,75,Revisit the ridiculous printing measures for allowing ride sharing and STR.,11,0.10230441391468048,"{'pos': 0.0017906452994793653, 'neg': 0.006909691262990236, 'sug': 0.9867983460426331, 'neut': 0.004501342307776213}",0.08549715578556061,,648ad137ffba66f356f16a4a,sug,0.9867983460426331
2,db0a12,austin_demo,1139,1,2,76,154,Stop bending to the unsafe taxi lobbying and realize how safe ride sharing is.,14,0.660652756690979,"{'pos': 0.003394532483071089, 'neg': 0.0858195424079895, 'sug': 0.8942601084709167, 'neut': 0.016525859013199806}",0.0,,648ad137ffba66f356f16a4b,sug,0.8942601084709167
3,db0a12,austin_demo,1049,0,2,0,86,Price gouging on rent and home price is going to become if not already a huge problem.,17,0.5930300354957581,"{'pos': 0.000603490334469825, 'neg': 0.995943009853363, 'sug': 0.0013428558595478535, 'neut': 0.0021106393542140722}",0.0,,648ad137ffba66f356f16a4c,neg,0.995943009853363
4,db0a12,austin_demo,1049,1,2,87,155,"Not sure that there is anything he can do, but he needs to be aware.",15,0.45955634117126465,"{'pos': 0.0022980747744441032, 'neg': 0.0052593001164495945, 'sug': 0.00629230635240674, 'neut': 0.986150324344635}",0.0,,648ad137ffba66f356f16a4d,neut,0.986150324344635
5,db0a12,austin_demo,778,0,2,0,94,More emphasis on long term planning as opposed to short term fixes should be tried in general.,17,0.6425195932388306,"{'pos': 0.0023504183627665043, 'neg': 0.003468980547040701, 'sug': 0.98997563123703, 'neut': 0.004204985219985247}",0.0,,648ad137ffba66f356f16a4e,sug,0.98997563123703
6,db0a12,austin_demo,778,1,2,95,155,(See improvements to intersections on 290 in Oak Hill area).,10,0.3501168191432953,"{'pos': 0.028887853026390076, 'neg': 0.0024130563251674175, 'sug': 0.012764538638293743, 'neut': 0.9559345841407776}",0.014659439213573933,,648ad137ffba66f356f16a4f,neut,0.9559345841407776
7,db0a12,austin_demo,590,0,1,0,156,I'm concerned about police treatment in Austin of our citizens of color - I worry about their safety and hope our officers are trained to protect all of us.,28,0.81444251537323,"{'pos': 0.0025291594211012125, 'neg': 0.8866859674453735, 'sug': 0.0628742203116417, 'neut': 0.047910697758197784}",0.0,,648ad137ffba66f356f16a50,neg,0.8866859674453735
8,db0a12,austin_demo,62,0,1,0,156,"As a mother of 3 young kids, this summer I discovered Austin libraries and was super impressed to find an inexpensive activity that all my kids could enjoy!",28,0.7585058212280273,"{'pos': 0.9933615922927856, 'neg': 0.0013633136404678226, 'sug': 0.000965666607953608, 'neut': 0.00430932966992259}",0.0,,648ad137ffba66f356f16a51,pos,0.9933615922927856
9,db0a12,austin_demo,926,0,2,0,40,Please address traffic on I35 and Mopac.,7,0.31218230724334717,"{'pos': 0.0017349717672914267, 'neg': 0.004532963037490845, 'sug': 0.9884911775588989, 'neut': 0.005240892060101032}",0.9121096730232239,,648ad137ffba66f356f16a52,sug,0.9884911775588989
10,db0a12,austin_demo,926,1,2,41,154,Discount I30 toll for big rigs and make the new toll lane on Mopac a regular lane to help with traffic flow 24-7.,24,0.6205693483352661,"{'pos': 0.0021082430612295866, 'neg': 0.0033478066325187683, 'sug': 0.9890875816345215, 'neut': 0.005456473212689161}",0.0,,648ad137ffba66f356f16a53,sug,0.9890875816345215
11,db0a12,austin_demo,842,0,3,0,61,NEED HAZARDOUS WASTE DISPOSAL NORTH AT LEAST 2 TIMES A MONTH.,11,0.34486693143844604,"{'pos': 0.001807057997211814, 'neg': 0.00316981365904212, 'sug': 0.9886015057563782, 'neut': 0.006421719677746296}",0.4035968780517578,,648ad137ffba66f356f16a54,sug,0.9886015057563782
12,db0a12,austin_demo,842,1,3,62,101,PERMITTING INSPECTION TIME IS TOO LONG.,6,0.25411826372146606,"{'pos': 0.001101217232644558, 'neg': 0.9950306415557861, 'sug': 0.0016646853182464838, 'neut': 0.0022034335415810347}",0.9938562512397766,,648ad137ffba66f356f16a55,neg,0.9950306415557861
13,db0a12,austin_demo,842,2,3,102,156,BIKES RUNNING STOP SIGNS TURNING LEFT FROM RIGHT LANE.,9,0.30725792050361633,"{'pos': 0.002589255105704069, 'neg': 0.9593470096588135, 'sug': 0.0046820384450256824, 'neut': 0.033381689339876175}",0.02093852311372757,,648ad137ffba66f356f16a56,neg,0.9593470096588135
14,db0a12,austin_demo,777,0,2,0,133,"More consideration to preservation of certain areas, more consideration to design of large buildings that influence our city's looks.",19,0.622214138507843,"{'pos': 0.0020341186318546534, 'neg': 0.003478091908618808, 'sug': 0.9900403618812561, 'neut': 0.004447468090802431}",0.0,,648ad137ffba66f356f16a57,sug,0.9900403618812561
15,db0a12,austin_demo,777,1,2,134,158,More affordable housing!,3,0.4028887152671814,"{'pos': 0.002960778772830963, 'neg': 0.003526770044118166, 'sug': 0.9850358963012695, 'neut': 0.008476602844893932}",0.9946280121803284,,648ad137ffba66f356f16a58,sug,0.9850358963012695
16,db0a12,austin_demo,1378,0,3,0,48,THE TRAFFIC AND THE POLICE NEED TO BE ADDRESSED.,9,0.25422295928001404,"{'pos': 0.004105727653950453, 'neg': 0.8017539978027344, 'sug': 0.17725060880184174, 'neut': 0.01688963733613491}",0.01575091853737831,,648ad137ffba66f356f16a59,neg,0.8017539978027344
17,db0a12,austin_demo,1378,1,3,49,89,NOTHING BEING SOLVED AS FAR AS PROBLEMS.,7,0.19711832702159882,"{'pos': 0.0009018255514092743, 'neg': 0.9946280121803284, 'sug': 0.001969982171431184, 'neut': 0.0025001782923936844}",0.025876853615045547,,648ad137ffba66f356f16a5a,neg,0.9946280121803284
18,db0a12,austin_demo,1378,2,3,90,159,HIRE MORE DETECTIVES AND POLICE TO SOLVE AT LEAST SOME OF THE ISSUES.,13,0.3822097182273865,"{'pos': 0.0018170676194131374, 'neg': 0.003981356043368578, 'sug': 0.9892330169677734, 'neut': 0.004968453198671341}",0.0,,648ad137ffba66f356f16a5b,sug,0.9892330169677734
19,db0a12,austin_demo,1317,0,2,0,102,"The city of Austin never seems to plan for future travel problems, we are always in the reacting mode.",19,0.5852223634719849,"{'pos': 0.0008335816091857851, 'neg': 0.9956259727478027, 'sug': 0.0017193565145134926, 'neut': 0.001821005716919899}",0.0,,648ad137ffba66f356f16a5c,neg,0.9956259727478027
20,db0a12,austin_demo,1317,1,2,103,159,by the time you get a road built it is already obsolete.,12,0.37967026233673096,"{'pos': 0.0008661922765895724, 'neg': 0.9923645257949829, 'sug': 0.00135710125323385, 'neut': 0.005412220489233732}",0.015009833499789238,,648ad137ffba66f356f16a5d,neg,0.9923645257949829
21,db0a12,austin_demo,582,0,1,0,161,"I would share with the Mayor that I love this city and it has become home to me, and while there is always room for improvement, it is a wonderful place to live!",33,0.7026873826980591,"{'pos': 0.9819491505622864, 'neg': 0.0016186462016776204, 'sug': 0.001713684992864728, 'neut': 0.014718473888933659}",0.0,,648ad137ffba66f356f16a5e,pos,0.9819491505622864
22,db0a12,austin_demo,1257,0,1,0,162,"Sustainability and conservation initiatives, housing affordability and bicycle transportation issues in the City of Austin are the most important issues for me/;.",22,0.5189374685287476,"{'pos': 0.004708698019385338, 'neg': 0.003302105236798525, 'sug': 0.0059021227061748505, 'neut': 0.9860870242118835}",0.0,,648ad137ffba66f356f16a5f,neut,0.9860870242118835
23,db0a12,austin_demo,299,0,2,0,88,Don't diminish any form of transportation and try to force citizens to use another form.,15,0.7418742179870605,"{'pos': 0.002167473081499338, 'neg': 0.027289556339383125, 'sug': 0.9635847210884094, 'neut': 0.006958323530852795}",0.0,,648ad137ffba66f356f16a60,sug,0.9635847210884094
24,db0a12,austin_demo,299,1,2,89,161,Add options without degrading others and add as many options as you can.,13,0.3221990168094635,"{'pos': 0.002368086716160178, 'neg': 0.0029300451278686523, 'sug': 0.9895110726356506, 'neut': 0.005190722644329071}",0.0,,648ad137ffba66f356f16a61,sug,0.9895110726356506
25,db0a12,austin_demo,1612,0,2,0,48,YOUR POLICY ON SHORT TERM RENTALS TOTALLY SUCKS.,8,0.36389467120170593,"{'pos': 0.0010689430637285113, 'neg': 0.9946475625038147, 'sug': 0.0021743387915194035, 'neut': 0.002109191147610545}",0.9933212399482727,,648ad137ffba66f356f16a63,neg,0.9946475625038147
26,db0a12,austin_demo,1612,1,2,49,163,YOU SHOULD SUPPORT THE SHARING ECONOMY AND POLICY OR PROGRAM THAT WOULD MAKE THE CITY AN AFFORDABLE PLACE TO LIVE.,20,0.4651559591293335,"{'pos': 0.0020286079961806536, 'neg': 0.0020442826207727194, 'sug': 0.9782965183258057, 'neut': 0.017630502581596375}",0.0,,648ad137ffba66f356f16a64,sug,0.9782965183258057
27,db0a12,austin_demo,855,0,1,0,164,"NEED TO HAVE A PLAN FOR BALANCING CITY GROWTH W/THE QUALITY OF LIFE/AFFORDABLITY FOR LOW INCOME, MINOIRTY, YOUNG, CREATIVE POPULATION AND ASSIST HOMELESS POPULATION",26,0.5556742548942566,"{'pos': 0.00260780262760818, 'neg': 0.0029949070885777473, 'sug': 0.9887484312057495, 'neut': 0.005648822523653507}",0.0,,648ad137ffba66f356f16a65,sug,0.9887484312057495
28,db0a12,austin_demo,365,0,1,0,164,"Fix Mopac - need to buy a row of houses on each side, should be a 12 lane road, more people are moving to this town every day, the traffic problem is getting worse.",33,0.588017463684082,"{'pos': 0.002013441873714328, 'neg': 0.00848781131207943, 'sug': 0.98185133934021, 'neut': 0.007647409103810787}",0.0,,648ad137ffba66f356f16a66,sug,0.98185133934021
29,db0a12,austin_demo,47,0,1,0,167,"Affordable housing is essential to keep Austin diverse, welcoming, and growing in the ways that reflect the progressive ideals of this city and the future generations.",26,0.9394307136535645,"{'pos': 0.003176409751176834, 'neg': 0.0026065504644066095, 'sug': 0.980830729007721, 'neut': 0.013386372476816177}",0.0,,648ad137ffba66f356f16a67,sug,0.980830729007721
30,db0a12,austin_demo,305,0,3,0,38,Don't stop enforcing development code.,5,0.24991290271282196,"{'pos': 0.0024123084731400013, 'neg': 0.0021413189824670553, 'sug': 0.9754766821861267, 'neut': 0.019969655200839043}",0.991175651550293,,648ad137ffba66f356f16a68,sug,0.9754766821861267
31,db0a12,austin_demo,305,1,3,39,116,"Set back requirements, etc., because some people have illegally built things.",11,0.1478314846754074,"{'pos': 0.002299292478710413, 'neg': 0.10878095030784607, 'sug': 0.8361813426017761, 'neut': 0.05273835361003876}",0.012138132937252522,,648ad137ffba66f356f16a69,sug,0.8361813426017761
32,db0a12,austin_demo,305,2,3,117,168,It is important it's not a waste of time and money.,11,0.3301655054092407,"{'pos': 0.0034239469096064568, 'neg': 0.007652155589312315, 'sug': 0.13743102550506592, 'neut': 0.8514928817749023}",0.8667882680892944,,648ad137ffba66f356f16a6a,neut,0.8514928817749023
33,db0a12,austin_demo,31,0,2,0,119,"Austin needs to get serious about alternatives to driving including real mass transit, bike, and pedestrian facilities.",17,0.8888238668441772,"{'pos': 0.002017156919464469, 'neg': 0.005913185887038708, 'sug': 0.985948920249939, 'neut': 0.006120836362242699}",0.0,,648ad137ffba66f356f16a6b,sug,0.985948920249939
34,db0a12,austin_demo,31,1,2,120,169,Public transit is critical in any connected city.,8,0.867050051689148,"{'pos': 0.006513108033686876, 'neg': 0.0040339273400604725, 'sug': 0.058139532804489136, 'neut': 0.9313133955001831}",0.9850264191627502,,648ad137ffba66f356f16a6c,neut,0.9313133955001831
35,db0a12,austin_demo,884,0,1,0,170,"ONE IS NOT ENOUGH TERMINAL TAX ON HOMES FOR FUTURE FLOOD CONTROL, FORGET SUBWAYS OR PROCURE MORE REAL ESTATE TO PURSUE AND IF GOES FORWARD PROVIDE SERVICE TO SOUTH AUSTIN",30,0.213661327958107,"{'pos': 0.0025953117292374372, 'neg': 0.03808089345693588, 'sug': 0.9482163190841675, 'neut': 0.011107529513537884}",0.0,,648ad137ffba66f356f16a6d,sug,0.9482163190841675
36,db0a12,austin_demo,433,0,2,0,67,"For a progressive city, Austin is lacking in public transportation.",10,0.674814760684967,"{'pos': 0.0008714883006177843, 'neg': 0.9945047497749329, 'sug': 0.0019713789224624634, 'neut': 0.0026523906271904707}",0.9901884198188782,,648ad137ffba66f356f16a6e,neg,0.9945047497749329
37,db0a12,austin_demo,433,1,2,68,170,There must be more focus on developing a comprehensive light rail system that runs throughout the day.,17,0.582124650478363,"{'pos': 0.0020110183395445347, 'neg': 0.003984053619205952, 'sug': 0.9897229671478271, 'neut': 0.004281866364181042}",0.0,,648ad137ffba66f356f16a6f,sug,0.9897229671478271
38,db0a12,austin_demo,499,0,1,0,171,"Hire more water/road repair crews so I wouldn't have to dodge the hole in my driveway, or worry about the manhole cover sinking and breaking the just repaired eater lines.",31,0.3889857828617096,"{'pos': 0.005232057999819517, 'neg': 0.385754257440567, 'sug': 0.5887696743011475, 'neut': 0.020244020968675613}",0.0,,648ad137ffba66f356f16a70,sug,0.5887696743011475
39,db0a12,austin_demo,66,0,1,0,172,"AS WE GROW PROTECT OUR WATER SUPPLY, WATERWAYS THE EDWARDS AQUIFER AND THE JEWEL IN OUR CROWN, BARTON SPRINGS ONCE THE WATER GOES THE PEOPLE GO, DON'T MESS WITH THE SPRINGS",31,0.43279942870140076,"{'pos': 0.009791417047381401, 'neg': 0.004741751588881016, 'sug': 0.8932625651359558, 'neut': 0.09220428019762039}",0.0,,648ad137ffba66f356f16a72,sug,0.8932625651359558
40,db0a12,austin_demo,251,0,2,0,38,Costs of energy are ridiculously high.,6,0.2636241614818573,"{'pos': 0.001237827935256064, 'neg': 0.9951289892196655, 'sug': 0.00139480154030025, 'neut': 0.0022383504547178745}",0.9968695044517517,,648ad137ffba66f356f16a73,neg,0.9951289892196655
41,db0a12,austin_demo,251,1,2,39,172,Austin Energy has made countless errors historically and the people are growing more suspicious the higher we are paying for service.,21,0.34263724088668823,"{'pos': 0.0009220659849233925, 'neg': 0.9959068298339844, 'sug': 0.0013053833972662687, 'neut': 0.0018656920874491334}",0.0,,648ad137ffba66f356f16a74,neg,0.9959068298339844
42,db0a12,austin_demo,1227,0,1,0,173,Stop supplementing the city budget with add-on fees to City of Austin utility bills and move city offices away from the current prime location and sell the land and offices.,31,0.5257900357246399,"{'pos': 0.0016999393701553345, 'neg': 0.01018709596246481, 'sug': 0.9801872372627258, 'neut': 0.007925746962428093}",0.0,,648ad137ffba66f356f16a75,sug,0.9801872372627258
43,db0a12,austin_demo,890,0,2,0,88,"Our property taxes keep increasing without reason, there are no improvements being made.",13,0.7563497424125671,"{'pos': 0.0007925939280539751, 'neg': 0.9958612322807312, 'sug': 0.0012288514990359545, 'neut': 0.0021173374261707067}",0.0,,648ad137ffba66f356f16a77,neg,0.9958612322807312
44,db0a12,austin_demo,890,1,2,89,173,"And, Austin City Council needs to improve - there is to be a way to voice our views.",17,0.2490415871143341,"{'pos': 0.0016948905540630221, 'neg': 0.004384471103549004, 'sug': 0.9877831339836121, 'neut': 0.006137420888990164}",0.0,,648ad137ffba66f356f16a78,sug,0.9877831339836121
45,db0a12,austin_demo,662,0,1,0,174,"KEEP AUSTIN QUALITY OF LIFE BY INVESTING IN TRAILS, BIKE LANES, SIDEWALKS, PARKS, THESE ARE IMPORTANT FOR ALL SOCIO-ECONOMIC LEVELS AND TO MAINTAIN A PEOPLE CENTRIC COMMUNITY",28,0.6223434805870056,"{'pos': 0.0036780491936951876, 'neg': 0.002343227155506611, 'sug': 0.9801011085510254, 'neut': 0.013877647928893566}",0.0,,648ad137ffba66f356f16a79,sug,0.9801011085510254
46,db0a12,austin_demo,1150,0,2,0,102,"SAFE TRANSPORTATION FOR PEDESTRIANS, CYCLIST, PUBLIC TRANSPORTATION AND CARS IS ALL EQUALLY IMPORTANT.",13,0.7175459265708923,"{'pos': 0.003905475838109851, 'neg': 0.0022693322971463203, 'sug': 0.9429451823234558, 'neut': 0.05087999999523163}",0.0,,648ad137ffba66f356f16a7a,sug,0.9429451823234558
47,db0a12,austin_demo,1150,1,2,103,174,PEOPLE THROUGHOUT AUSTIN DESERVE ACCESS TO WELL STAFFED PARKS AND POOLS,11,0.5754721164703369,"{'pos': 0.00191947550047189, 'neg': 0.002845676150172949, 'sug': 0.9897575378417969, 'neut': 0.005477314814925194}",0.9633914828300476,,648ad137ffba66f356f16a7b,sug,0.9897575378417969
48,db0a12,austin_demo,1291,0,3,0,22,the 311 system stinks.,4,0.2744344174861908,"{'pos': 0.001392878475598991, 'neg': 0.9940295219421387, 'sug': 0.0022416249848902225, 'neut': 0.002335922559723258}",0.9970744848251343,,648ad137ffba66f356f16a7c,neg,0.9940295219421387
49,db0a12,austin_demo,1291,1,3,23,121,Do what Boston did: no new office or condo construction until occupancy reached 85% all of Austin.,17,0.2743925154209137,"{'pos': 0.00340879219584167, 'neg': 0.0037434508558362722, 'sug': 0.9787253737449646, 'neut': 0.014122403226792812}",0.0,,648ad137ffba66f356f16a7d,sug,0.9787253737449646
50,db0a12,austin_demo,1291,2,3,122,173,"And dear god, stop using Zilker Park for festivals.",9,0.3759201765060425,"{'pos': 0.005517725367099047, 'neg': 0.5218185186386108, 'sug': 0.4155822694301605, 'neut': 0.05708155035972595}",0.9752601981163025,,648ad137ffba66f356f16a7e,neg,0.5218185186386108
51,db0a12,austin_demo,86,0,4,0,25,Austin is not affordable.,4,0.382092148065567,"{'pos': 0.0010782243916764855, 'neg': 0.9926109910011292, 'sug': 0.0020670758094638586, 'neut': 0.004243720788508654}",0.9921088814735413,,648ad137ffba66f356f16a7f,neg,0.9926109910011292
52,db0a12,austin_demo,86,1,4,26,82,Traffic is horrible and makes it hard to enjoy the city.,11,0.49407652020454407,"{'pos': 0.0009456180850975215, 'neg': 0.9950796365737915, 'sug': 0.0019018432358279824, 'neut': 0.0020729699172079563}",0.9858814477920532,,648ad137ffba66f356f16a80,neg,0.9950796365737915
53,db0a12,austin_demo,86,2,4,83,124,Austin nites stay home to avoid tourists.,7,0.13942234218120575,"{'pos': 0.003124518319964409, 'neg': 0.009594076313078403, 'sug': 0.007660295814275742, 'neut': 0.9796211123466492}",0.01765741966664791,,648ad137ffba66f356f16a82,neut,0.9796211123466492
54,db0a12,austin_demo,86,3,4,125,176,Our city is held hostage by visitors and newcomers.,9,0.22702203691005707,"{'pos': 0.0011478650849312544, 'neg': 0.9941285848617554, 'sug': 0.0014836816117167473, 'neut': 0.0032399678602814674}",0.9945976734161377,,648ad137ffba66f356f16a83,neg,0.9941285848617554
55,db0a12,austin_demo,579,0,1,0,176,I would love to see additional sand volleyball court at Zilker park or at least the current courts taken care of with new sand but doubling the amount of courts would be great.,33,0.6759370565414429,"{'pos': 0.002469009952619672, 'neg': 0.002910575596615672, 'sug': 0.9893121123313904, 'neut': 0.005308364983648062}",0.0,,648ad137ffba66f356f16a84,sug,0.9893121123313904
56,db0a12,austin_demo,423,0,2,0,65,Get the water bills straightened out - I'm paying way too much!!!,11,0.27165427803993225,"{'pos': 0.0034811822697520256, 'neg': 0.16799584031105042, 'sug': 0.8054520487785339, 'neut': 0.02307089790701866}",0.9899600744247437,,648ad137ffba66f356f16a85,sug,0.8054520487785339
57,db0a12,austin_demo,423,1,2,66,176,Extend bus service to southwest Austin (southern end of Brodie Lane) before you add to the city's rail system.,19,0.49274688959121704,"{'pos': 0.001989550655707717, 'neg': 0.0033801915124058723, 'sug': 0.9891023635864258, 'neut': 0.005527881905436516}",0.0,,648ad137ffba66f356f16a86,sug,0.9891023635864258
58,db0a12,austin_demo,1528,0,4,0,71,We need a neighbor center on Braker Lane between Lamar and Kramer Lane.,13,0.322390079498291,"{'pos': 0.0017290443647652864, 'neg': 0.0035159592516720295, 'sug': 0.985654890537262, 'neut': 0.009100125171244144}",0.0,,648ad137ffba66f356f16a87,sug,0.985654890537262
59,db0a12,austin_demo,1528,1,4,72,104,The seniors do not have a place.,7,0.1409483253955841,"{'pos': 0.0010108060669153929, 'neg': 0.9951825737953186, 'sug': 0.0016632088227197528, 'neut': 0.0021434130612760782}",0.6393393278121948,,648ad137ffba66f356f16a88,neg,0.9951825737953186
60,db0a12,austin_demo,1528,2,4,105,158,The nearest pool for this area is on far North Lamar.,11,0.3044911324977875,"{'pos': 0.0030725481919944286, 'neg': 0.003605291713029146, 'sug': 0.003870240179821849, 'neut': 0.9894519448280334}",0.018810110166668892,,648ad137ffba66f356f16a89,neut,0.9894519448280334
61,db0a12,austin_demo,1528,3,4,159,178,We need a pool too!,5,0.23719525337219238,"{'pos': 0.0030742015223950148, 'neg': 0.013344467617571354, 'sug': 0.07740762829780579, 'neut': 0.9061737656593323}",0.1833946853876114,,648ad137ffba66f356f16a8a,neut,0.9061737656593323
62,db0a12,austin_demo,1134,0,3,0,44,Responsible commercial/residential planning.,4,0.2886771261692047,"{'pos': 0.0022117262706160545, 'neg': 0.002333149779587984, 'sug': 0.9848666787147522, 'neut': 0.010588505305349827}",0.7381058931350708,,648ad137ffba66f356f16a8b,sug,0.9848666787147522
63,db0a12,austin_demo,1134,1,3,45,128,"Limiting of new condos, preserving spaces that are important to Austin's character.",12,0.545436441898346,"{'pos': 0.002109823515638709, 'neg': 0.0025624639820307493, 'sug': 0.9772360324859619, 'neut': 0.018091659992933273}",0.016657570376992226,,648ad137ffba66f356f16a8c,sug,0.9772360324859619
64,db0a12,austin_demo,1134,2,3,129,177,Keep Austin Weird not Keep coming Los Angeleans.,8,0.2616966962814331,"{'pos': 0.0424807071685791, 'neg': 0.003870876505970955, 'sug': 0.038475170731544495, 'neut': 0.9151732325553894}",0.01687319204211235,,648ad137ffba66f356f16a8d,neut,0.9151732325553894
65,db0a12,austin_demo,632,0,2,0,70,Increase the recycle program collection to weekly instead of biweekly.,10,0.45515647530555725,"{'pos': 0.0024189732503145933, 'neg': 0.003166184527799487, 'sug': 0.9894927740097046, 'neut': 0.00492210453376174}",0.993631899356842,,648ad137ffba66f356f16a8e,sug,0.9894927740097046
66,db0a12,austin_demo,632,1,2,71,178,"Also, start life guard certification program earlier in the year instead of just prior to summer beginning!",17,0.3268018364906311,"{'pos': 0.0019231042824685574, 'neg': 0.003399933222681284, 'sug': 0.9894710779190063, 'neut': 0.005205847788602114}",0.0,,648ad137ffba66f356f16a91,sug,0.9894710779190063
67,db0a12,austin_demo,1348,0,2,0,92,The fluoride in the city's drinking water is my number one concern/complaint about the city.,16,0.401021808385849,"{'pos': 0.000934376148506999, 'neg': 0.9956362843513489, 'sug': 0.0013876415323466063, 'neut': 0.0020417131017893553}",0.0,,648ad137ffba66f356f16a92,neg,0.9956362843513489
68,db0a12,austin_demo,1348,1,2,93,181,"We deserve clean drinking water, not poisoned with endocrine disruptors and neurotoxins.",12,0.6877339482307434,"{'pos': 0.004860620480030775, 'neg': 0.35460206866264343, 'sug': 0.5874243974685669, 'neut': 0.05311291292309761}",0.02713143453001976,,648ad137ffba66f356f16a93,sug,0.5874243974685669
69,db0a12,austin_demo,1033,0,5,0,33,Please stop over growth of city!!,6,0.2021634727716446,"{'pos': 0.0033570723608136177, 'neg': 0.20248490571975708, 'sug': 0.7676351070404053, 'neut': 0.02652290090918541}",0.9958244562149048,,648ad137ffba66f356f16a94,sug,0.7676351070404053
70,db0a12,austin_demo,1033,1,5,34,78,It cannot handle the high number of people!!,9,0.31382668018341064,"{'pos': 0.0008202536264434457, 'neg': 0.9952762126922607, 'sug': 0.0017305949004366994, 'neut': 0.0021728298161178827}",0.9893540143966675,,648ad137ffba66f356f16a95,neg,0.9952762126922607
71,db0a12,austin_demo,1033,2,5,79,115,Does not feel like Austin any more!!,7,0.2004474401473999,"{'pos': 0.001038462040014565, 'neg': 0.9943262934684753, 'sug': 0.0020802156068384647, 'neut': 0.0025549745187163353}",0.05151772499084473,,648ad137ffba66f356f16a96,neg,0.9943262934684753
72,db0a12,austin_demo,1033,3,5,116,180,Miss being able to do our Austin activities due to overcrowding!,11,0.23477743566036224,"{'pos': 0.0008247694931924343, 'neg': 0.993919849395752, 'sug': 0.0014359665801748633, 'neut': 0.003819521050900221}",0.9296343922615051,,648ad137ffba66f356f16a97,neg,0.993919849395752
73,db0a12,austin_demo,7,0,2,0,73,(1) You cannot continue to fund city activities only from property taxes.,13,0.39659780263900757,"{'pos': 0.0033214285504072905, 'neg': 0.5391345024108887, 'sug': 0.3576822876930237, 'neut': 0.09986182302236557}",0.0,,648ad137ffba66f356f16a98,neg,0.5391345024108887
74,db0a12,austin_demo,7,1,2,74,183,(2) You cannon expect people in the suburbs to fund the transportation needs of high density downtown living.,18,0.5721253156661987,"{'pos': 0.0009077309514395893, 'neg': 0.9774079918861389, 'sug': 0.007562261074781418, 'neut': 0.014122014865279198}",0.0,,648ad137ffba66f356f16a99,neg,0.9774079918861389
75,db0a12,austin_demo,1242,0,4,0,53,stops providing for and making sprawl easy to happen.,9,0.4175131022930145,"{'pos': 0.0054785022512078285, 'neg': 0.4480244517326355, 'sug': 0.4130381941795349, 'neut': 0.1334589123725891}",0.01716349646449089,,648ad137ffba66f356f16a9a,neg,0.4480244517326355
76,db0a12,austin_demo,1242,1,4,54,71,Encourage infill.,2,0.3481157124042511,"{'pos': 0.0026533810887485743, 'neg': 0.003075068350881338, 'sug': 0.9851477742195129, 'neut': 0.009123717434704304}",0.9957430958747864,,648ad137ffba66f356f16a9b,sug,0.9851477742195129
77,db0a12,austin_demo,1242,2,4,72,157,We want/have high quality services but do not have sufficient tax base to provide it.,16,0.42640721797943115,"{'pos': 0.00096849724650383, 'neg': 0.9677028656005859, 'sug': 0.012609794735908508, 'neut': 0.018718913197517395}",0.0,,648ad137ffba66f356f16a9d,neg,0.9677028656005859
78,db0a12,austin_demo,1242,3,4,158,180,It is not sustainable.,4,0.4103116989135742,"{'pos': 0.0009656611364334822, 'neg': 0.9932085871696472, 'sug': 0.0016606634017080069, 'neut': 0.004165021236985922}",0.9936324954032898,,648ad137ffba66f356f16a9e,neg,0.9932085871696472
